title,description,url,publishedAt,source,content
Can the US Truly Come Back From Trump 2.0?,"“We’re back,” I tell the room. It’s January 21, 2029, and I can barely contain my excitement. “America is back!”I expect applause, but there is none.I try again, louder this time. “After four long years, America is finally back! We’re ready to resume our inte…",https://tomdispatch.com/approaching-the-end-of-liberal-internationalism/,2025-06-17T16:22:40Z,Tomdispatch.com,"Were back, I tell the room. Its January 21, 2029, and I can barely contain my excitement. America is back!
I expect applause, but there is none.
I try again, louder this time. After four long years… [+13598 chars]"
Asia’s Autocrats Welcome USAID’s End,Conspiracy theories about U.S. power are now shared by the Trump administration.,http://foreignpolicy.com/2025/06/17/asia-dictators-usaid-trump-conspiracy-theories/,2025-06-17T14:04:03Z,Foreign Policy,"Elon Musk and U.S. President Donald Trump have gutted the U.S. Agency for International Development (USAID), the long-standing U.S. program focused on humanitarian aid. But despite cries of outrage f… [+9280 chars]"
"When developing countries band together, lifesaving drugs become cheaper and easier to buy − with trade-offs",Pharmaceutical companies have little incentive to sell drugs to countries that can’t afford them. But bargaining together can increase access to vital treatments worldwide.,https://theconversation.com/when-developing-countries-band-together-lifesaving-drugs-become-cheaper-and-easier-to-buy-with-trade-offs-255383,2025-06-17T12:34:40Z,The Conversation Africa,"Pooling procurement of drugs could increase the availability of essential treatments around the globe. narvo vexar/iStock via Getty Images Plus
Procuring lifesaving drugs is a daunting challenge in … [+8144 chars]"
Asian Philanthropy Can and Must Lead From Within (Blog),"How Asian philanthropists are embracing adaptive, blended, and locally informed approaches to transform the uncertainty of global aid into opportunity.",https://ssir.org/articles/entry/asian-philanthropy-response-to-global-aid-cuts,2025-06-17T12:00:00Z,Ssir.org,Asian philanthropists are increasingly concerned about the ripple effects of shrinking global aid. In addition to the striking financial clawback and restructuring of the US Agency for International … [+10675 chars]
"Philanthropy Must Stand, Deliver, and Listen (Blog)",Any response to this moment must include careful reflection on philanthropy's role in a democratic society.,https://ssir.org/articles/entry/philanthropy-must-stand-deliver-and-listen,2025-06-17T12:00:00Z,Ssir.org,"If there is one thing that distinguishes the role philanthropy must play in the current crisis brought on by the Trump administrations dismantling of the liberal state, it is the extent to which phil… [+8396 chars]"
The Left Not So Happy With The Monster They Created,"The pervasive talking point of the Left since President Trump returned to office is that he is trying to make himself into a “dictator.” Starting in the early weeks of his new term, the main evidence for the “dictator” claim was said to be Trump’s actions to …",https://freerepublic.com/focus/f-chat/4323530/posts,2025-06-17T11:51:59Z,Freerepublic.com,"Skip to comments.
The Left Not So Happy With The Monster They CreatedManhattan Contrarian ^
 | 13 Jun, 2025
 | Francis Menton
Posted on 06/17/2025 4:51:59 AM PDT by MtnClimber
The pervasive talk… [+7801 chars]"
"Nepal witnesses fall in foreign aid, grants in recent years","Kathmandu, June 17: Nepal is facing a sharp decline in foreign aid at a time when domestic revenue collection has […]
The post Nepal witnesses fall in foreign aid, grants in recent years appeared first on Peoples' Review.",https://mypeoplesreview.com/2025/06/17/nepal-witnesses-fall-in-foreign-aid-grants-in-recent-years/,2025-06-17T10:15:00Z,Mypeoplesreview.com,"Kathmandu, June 17: Nepal is facing a sharp decline in foreign aid at a time when domestic revenue collection has fallen short, creating a funding gap for national development. In the past four years… [+3275 chars]"
Weaponizing Food Worsens Starvation,"Wars, economic shocks, planetary heating and aid cuts have worsened food crises in recent years, with almost 300 million people now threatened by starvation. Why hunger? World food production has increased almost fourfold since 1960. FAO statistics indicate e…",https://www.ipsnews.net/2025/06/weaponizing-food-worsens-starvation/,2025-06-17T06:21:39Z,Inter Press Service,"Armed Conflicts, Economy &amp; Trade, Environment, Food and Agriculture, Food Security and Nutrition, Food Sustainability, Food Systems, Global, Headlines, Inequality, Poverty &amp; SDGs, TerraViva U… [+5406 chars]"
"Former USAID contracting officer, three corporate executives plead guilty to $550M federal contract bribery scheme","Former USAID contracting officer Roderick Watson and three corporate executives pleaded guilty to a decade-long bribery scheme that secured over $550 million in federal contracts through corruption. The scheme involved Apprio, Inc. and PM Consulting Group LLC…",https://www.naturalnews.com/2025-06-17-usaid-official-executives-plead-guilty-bribery-scheme.html,2025-06-17T06:00:00Z,Naturalnews.com,<ul><li>Former USAID contracting officer Roderick Watson and three corporate executives pleaded guilty to a decade-long bribery scheme that secured over $550 million in federal contracts through corr… [+5539 chars]
"EPP backtracks from commitments on UN Agenda 2030, and sides with far right","Due to the EPP siding with the far right, the European Parliament has voted down the report on financing for development ahead of the Fourth International Conference in Seville. The report should have called on member states to increase their commitment to in…",http://pr.euractiv.com/node/270281,2025-06-16T23:00:00Z,EURACTIV,"Due to the EPP siding with the far right, the European Parliament has voted down the report on financing for development ahead of the Fourth International Conference in Seville. The report should hav… [+3061 chars]"
Sudan in danger of self-destructing as conflict and famine reign,"The war is in strategic stalemate, but Sudan is no-one's priority - an orphan in a region that is ablaze.",https://www.bbc.com/news/articles/cg717385nj7o,2025-06-16T22:53:57Z,BBC News,"Alex de Waal
More than half of Sudan's 45 million people have been wrenched from their homes
Sudan's war is in strategic stalemate. Each side stakes its hopes on a new offensive, a new delivery of … [+7467 chars]"
"No Kings, Just Chaos","As Trump’s $45 million military pageant fizzled, millions joined protests, a political assassination shook Minnesota, and Israel launched surprise strikes on Iran. Our editors make sense of a disorienting weekend.
The post No Kings, Just Chaos appeared first …",http://washingtonmonthly.com/2025/06/16/no-kings-just-chaos/,2025-06-16T18:48:56Z,Washington Monthly,"Washington Monthly Editor in Chief Paul Glastris, Politics Editor Bill Scher and Executive Editor for Digital Matt Cooper join Anne Kim to talk about this weekend’s protests, Trump’s flop of a milita… [+32452 chars]"
Academy of Nutrition and Dietetics Leads Trusted Health Organizations in Urging Congress to Protect Investments in Nutrition Security,"Chicago, June 16, 2025 (GLOBE NEWSWIRE) -- The Academy of Nutrition and Dietetics, the world’s largest organization of food and nutrition professionals, sent a letter to key members of Congress on Friday, June 13, 2025, urging them to reject proposed cuts to …",https://www.globenewswire.com/news-release/2025/06/16/3100111/0/en/Academy-of-Nutrition-and-Dietetics-Leads-Trusted-Health-Organizations-in-Urging-Congress-to-Protect-Investments-in-Nutrition-Security.html,2025-06-16T16:18:00Z,GlobeNewswire,"Chicago, June 16, 2025 (GLOBE NEWSWIRE) -- The Academy of Nutrition and Dietetics, the worlds largest organization of food and nutrition professionals, sent a letter to key members of Congress on Fri… [+11628 chars]"
How Johnson pulled off another impossible win with just 1-vote margin on $9.4B spending cut bill,"House Republicans pass $9.4 billion spending cuts bill with a 214-212 vote, showcasing Speaker Johnson's ability to navigate tough legislation despite the slim GOP majority in the House.",https://www.foxnews.com/politics/how-johnson-pulled-off-another-impossible-win-just-1-vote-margin-9-4b-spending-cut-bill,2025-06-16T15:57:45Z,Fox News,"Join Fox News for access to this content
Plus special access to select articles and other premium content with your account - free of charge.
By entering your email and pushing continue, you are ag… [+8910 chars]"
Why Senate Republicans might not let Trump give back $9.3 billion,"Trump's effort to codify DOGE cuts to via rescission package could be in trouble in the Senate as funding PBS, NPR, and USAID remains popular with some senators",https://biztoc.com/x/5c0679c936fe6eb9,2025-06-16T10:49:16Z,Biztoc.com,"Trump's effort to codify DOGE cuts to via rescission package could be in trouble in the Senate as funding PBS, NPR, and USAID remains popular with some senators
This story appeared on msnbc.com, 202… [+16 chars]"
"‘We Are Less Safe, Plain and Simple’","Former CDC director Tom Frieden warns that when it comes to the damage Trump and RFK Jr. are doing to the CDC and public health: ‘We are less safe, plain and simple.’",http://nymag.com/intelligencer/article/tom-frieden-on-trump-and-rfk-jr-attack-on-cdc-public-health.html,2025-06-16T10:00:41Z,New York Magazine,"When Donald Trump vowed to let Robert F. Kennedy Jr. go wild on Americas health in October, he meant it. The Health and Human Services secretary has overseen a bloodbath at Americas public health age… [+21550 chars]"
Why Senate Republicans might not let Trump give back $9.3 billion,"Trump's effort to codify DOGE cuts to via rescission package could be in trouble in the Senate as funding PBS, NPR, and USAID remains popular with some senators",https://www.msnbc.com/opinion/msnbc-opinion/trump-doge-senate-rescission-bill-rcna212870,2025-06-16T10:00:00Z,MSNBC,"Last week, House Republicans narrowly passed President Donald Trumps so-called rescissions package. The bill would rescind $9.3 billion in previously appropriated funding, including $1.1 billion from… [+4894 chars]"
Israel’s Crimes of the Century,Alleging Israel has committed ‘war crimes’ suggests a recognizable event: that there is a war happening and there are some crimes in it. Gaza is different.,http://nymag.com/intelligencer/article/israel-palestine-gaza-war-crimes-genocide.html,2025-06-16T09:00:36Z,New York Magazine,"On April 4, the Palestinian poet Mosab Abu Toha posted a video of an obliterated urban landscape. Suddenly, there are bombs: Smoke erupts from the base of the buildings, and two large objects are eje… [+61397 chars]"
Trump’s Trade School Trojan Horse,"Trump’s Trade School Trojan Horse

 


 
Elizabeth Redden

Mon, 06/16/2025 - 03:00 AM

Higher ed must resist attempts to pit one sector against another, Rachel Lipson and Robert Schwartz write.
 
 Byline(s)

 
 Rachel Lipson

 Robert Schwartz",https://www.insidehighered.com/opinion/views/2025/06/16/dont-fall-trumps-trade-school-trojan-horse-opinion,2025-06-16T07:00:00Z,Inside Higher Ed,"In one of his all-too-frequent rants on Truth Social last month, President Trump posted, I am considering taking Three Billion Dollars of Grant Money away from a very antisemitic Harvard, and giving … [+5054 chars]"
"House passes $9.4 billion rescissions bill slashing NPR, PBS, USAID funding","The U.S. House narrowly approved a bill on June 12 cutting $9.4 billion from public broadcasting and foreign aid, marking the first implementation of recommendations from DOGE. The bill includes $8.3 billion in cuts to USAID programs, such as refugee aid, gen…",https://www.naturalnews.com/2025-06-16-house-passes-bill-slashing-npr-pbs-usaid-funding.html,2025-06-16T06:00:00Z,Naturalnews.com,"<ul><li>The U.S. House narrowly approved a bill on June 12 cutting $9.4 billion from public broadcasting and foreign aid, marking the first implementation of recommendations from DOGE.</li><li>The bi… [+5067 chars]"
War at the Top,"The falling out between Donald Trump and Elon Musk would make a grand opera. Two titans of business who entered a political marriage of convenience have had a predictable clash of egos and, instead of parting company privately, have flung mud at each other in…",https://www.counterpunch.org/2025/06/16/war-at-the-top/,2025-06-16T05:56:36Z,CounterPunch,"Photograph Source: The White House – Public Domain
The falling out between Donald Trump and Elon Musk would make a grand opera. Two titans of business who entered a political marriage of convenience… [+9337 chars]"
Approaching the End of Liberal Internationalism: Will America Ever Rejoin the International Community?,"( Tomdispatch.com ) - “We’re back,” I tell the room. It’s January 21, 2029, and I can barely contain my excitement. “America is back!” I expect applause, but there is none. I try again, louder this time. “After four long years, America is finally back! We’re …",https://www.juancole.com/2025/06/approaching-internationalism-international.html,2025-06-16T04:04:59Z,Juancole.com,"( Tomdispatch.com ) – “We’re back,” I tell the room. It’s January 21, 2029, and I can barely contain my excitement. “America is back!”
I expect applause, but there is none.
I try again, louder this… [+13620 chars]"
USAID cuts risk reviving TB – ‘disaster is looming’,"Vital research, support and tracing efforts to contain the infectious disease in countries, including India, are struggling to survive.",https://scroll.in/article/1083244/disaster-is-looming-usaid-cuts-risk-reviving-tb,2025-06-15T14:01:45Z,Scroll.in,"At a tense meeting in Nigerias capital Abuja, health workers poured over drug registers and testing records to gauge whether US aid cuts would unravel years of painstaking work against tuberculosis i… [+5492 chars]"
"USAID Official and Three Others Plead Guilty After Decade-Long, Half-Billion Dollar Bribery Scheme Falls Apart","The bribes included cash, laptops, thousands of dollars in tickets to a suite at an NBA game, a country club wedding, and jobs for relatives.",https://www.westernjournal.com/usaid-official-three-others-plead-guilty-decade-long-half-billion-dollar-bribery-scheme-falls-apart/,2025-06-15T11:38:04Z,Westernjournal.com,"An official with a government agency that President Donald Trump targeted for elimination has pleaded guilty, along with three businessmen, to being part of a decade-long bribery scheme that involved… [+4775 chars]"
How Trump Is Transforming Higher Education: The View from 4 Campuses,"Steven Yoder, Felicia Mello, Alexandra Villarreal, Miles MacClure



At universities in California, Illinois, Louisiana, and Texas, students report changes to clubs, diminished research opportunities, and fears for international students’ safety.




The po…",https://www.thenation.com/article/society/trump-higher-education-california-illinois-louisiana-texas/,2025-06-15T08:45:00Z,Thenation.com,"At universities in California, Illinois, Louisiana, and Texas, students report changes to clubs, diminished research opportunities, and fears for international students safety.
Ad Policy
People wal… [+27298 chars]"
G7 summit: Who is attending and what’s on the agenda?,"With Donald Trump back at the helm in the US, this week's G7 meeting is expected to be tense after he walked out in 2018",https://www.aljazeera.com/news/2025/6/15/g7-summit-who-is-attending-and-whats-on-the-agenda,2025-06-15T04:25:46Z,Al Jazeera English,"Leaders of the Group of Seven (G7) countries Canada, France, Germany, Italy, Japan, the United Kingdom and the US will meet on Sunday in the remote town of Kananaskis, Alberta, nestled in the foothil… [+10710 chars]"
US AID freeze affecting local health programmes,"Health and Social Services Minister Dr. Esperance Luvindao says several local health programmes have been affected by the 90-day pause in United States foreign aid, including reduced support for healthcare workers and essential services.",https://nbcnews.na/node/111403,2025-06-14T18:15:55Z,Nbcnews.na,"Health and Social Services Minister Dr. Esperance Luvindao says several local health programmes have been affected by the 90-day pause in United States foreign aid, including reduced support for heal… [+2097 chars]"
USAID Official and Three Corporate Executives Plead Guilty to Decade-Long Bribery Scheme Involving Over $550 Million in Contracts; Two Companies Admit Criminal Liability for Bribery Scheme and Securities Fraud,"Four men, including a government contracting officer for the United States Agency for International Development (USAID) and three owners and presidents of companies, have pleaded guilty for their roles in a decade-long bribery scheme involving at least 14 pri…",https://freerepublic.com/focus/f-chat/4323013/posts,2025-06-14T16:11:10Z,Freerepublic.com,"Four men, including a government contracting officer for the United States Agency for International Development (USAID) and three owners and presidents of companies, have pleaded guilty for their rol… [+12059 chars]"
Tax Breaks: The New Chapter Is Beginning At The IRS Edition,"Plus: A new IRS commissioner, update on the Big Beautiful Bill Act, the jock tax, donating clothes to charity, IRS efforts to thwart identity theft, filing deadlines, tax trivia, and more.",https://www.forbes.com/sites/kellyphillipserb/2025/06/14/tax-breaks-the-new-chapter-is-beginning-at-the-irs-edition/,2025-06-14T14:00:00Z,Forbes,"It's a new chapter at the IRS.
getty
The traditional individual tax filing season ended two months ago (those of us on extension still have a few months to go), but the IRS is still in the news. Mo… [+20020 chars]"
Global Health Governance in the Age of AI | Think Global Health,National security agencies and tech regulators are rapidly developing governance for AI and biotechnology,https://www.thinkglobalhealth.org/article/global-health-governance-age-ai,2025-06-14T12:14:11Z,Thinkglobalhealth.org,The systems designed to shield the world from biological catastrophe are quietly falling behind. A silent shift is underway as artificial intelligence (AI) transforms pathogen design and synthetic bi… [+9319 chars]
Trump’s “aid” boss oversees lethal food distribution in Gaza,Rev. Johnnie Moore dismisses Palestinian deaths as “without incident.”,https://electronicintifada.net/blogs/michael-f-brown/trumps-aid-boss-oversees-lethal-food-distribution-gaza,2025-06-14T05:35:16Z,Electronicintifada.net,"Michael F. BrownRights and Accountability14 June 2025
A Palestinian child rests in the Nasser Medical Complex after being shot in the abdomen by Israeli occupation forces while seeking food at a Gaz… [+10605 chars]"
How Trump's Africa strategy may become a double-edged sword,US aid to Africa has been cut and now defence is in Trump's sights - but it may prove more costly.,https://www.bbc.com/news/articles/cj427q1rk58o,2025-06-14T02:00:10Z,BBC News,"The focus of US military strategy in Africa is changing under Trump
With US President Donald Trump on a cost-cutting warpath since starting his second term, aid to Africa has been slashed and now de… [+8801 chars]"
USAID official pleads guilty to taking part in $550M bribery scheme: ‘Violated the public trust’,"Roderick Watson, of Maryland, is alleged to have received bribes valued in excess of $1 million while working at USAID, in exchange for using his position as a trusted overseer of taxpayer money.",https://nypost.com/2025/06/13/us-news/usaid-official-pleads-guilty-to-taking-part-in-550m-bribery-scheme-violated-the-public-trust/,2025-06-14T00:15:26Z,New York Post,A federal contracting officer and three businessmen pleaded guilty Thursday to participating in a $550 million bribery scheme involving the embattled US Agency for International Development (USAID). … [+3408 chars]
"USAID official, 3 execs plead guilty in bribery scheme with over $550 million in contracts",A United States Agency of International Development (USAID) official as well as three corporate executives have pleaded guilty in a decades-long bribery scheme connected to over $550 million in contracts. According to a press release from the Department of Ju…,https://freerepublic.com/focus/f-news/4322923/posts,2025-06-13T23:17:29Z,Freerepublic.com,"Skip to comments.
USAID official, 3 execs plead guilty in bribery scheme with over $550 million in contractsthepostmillenial.com ^
 | June 13, 2025
 | Thomas Stevenson
Posted on 06/13/2025 4:17:2… [+3431 chars]"
How El Salvador’s Government Impeded a Probe of MS-13,"This story was published first by ProPublica, a nonprofit newsroom that investigates abuses of power. Sign up for ProPublica’s Big Story newsletter to receive our biggest stories as soon as they are published. In mid-April, President Donald Trump sat down in …",https://www.motherjones.com/politics/2025/06/how-el-salvadors-government-impeded-a-probe-of-ms-13-trump-usaid/,2025-06-13T20:05:30Z,Mother Jones,"President Donald Trump meets with El Salvador President Nayib Bukele in the Oval Office on April 14, 2025.Daniel Torok/White House/ZUMA
Get your news from a source thats not owned and controlled by … [+34487 chars]"
A Thousand Cuts To Higher Education: When ‘To What End?’ Gives Way To ‘What To End?’ (And ‘Where To Next?’),Threats and changes are happening so quickly and there are so many to track that the impacts are becoming incalculable. Higher ed is on the verge of “throw up the hands” moment that neither the institutions nor the nation can afford.,https://www.forbes.com/sites/davidrosowsky/2025/06/13/a-thousand-cuts-to-higher-education-when-to-what-end-gives-way-to-what-to-end-and-where-to-next/,2025-06-13T19:57:45Z,Forbes,"Authors note: This essay is not political, either overtly or in its underlying message. It is not partisan, nor is it part of a lobbying effort. It is (I hope) neither defensive nor offensive. Rather… [+15582 chars]"
Trump Is Trying To Defund An Agency That Saves Billions In Taxpayer Money,The White House wants to slash the $85 million budget to $0 for the inspector general’s office that focuses on investigating fraud in foreign aid.,https://www.forbes.com/sites/thomasbrewster/2025/06/13/trump-defunding-an-agency-saving-billions-in-taxpayer-money/,2025-06-13T18:05:21Z,Forbes,"President Trump isn't just trying to get rid of USAID, he has plans to defund the agency that investigates the foreign aid department for fraud, waste and child abuse, among other crimes. (Photo by A… [+6789 chars]"
El Salvador President and Trump Ally Bukele Accused of Cutting Deals With MS-13 Gang Members Using U.S. Aid,"Nayib Bukele has come to be known as the face fighting against gang violence and justice. However, a new ProPublica investigation reveals that image may be misleading.",https://www.ibtimes.com/el-salvador-president-trump-ally-bukele-accused-cutting-deals-ms-13-gang-members-using-us-aid-3775587,2025-06-13T17:19:57Z,International Business Times,"In the first months of the Trump administration, the U.S. president found a close ally in El Salvador leader Nayib Bukele, particularly by making a deal to quickly deport Venezuelan migrants believed… [+3686 chars]"
"Codifying DOGE cuts, Republicans vote to claw back foreign aid, NPR and PBS funds","On Capitol Hill, it’s common for lawmakers to approve funding measures, but it’s more unusual to see members un-approve funding through rescissions packages.",https://www.msnbc.com/rachel-maddow-show/maddowblog/codifying-doge-cuts-republicans-vote-claw-back-foreign-aid-npr-pbs-fun-rcna212887,2025-06-13T16:21:08Z,MSNBC,"On Capitol Hill, its common for lawmakers to approve funding measures, but its far more unusual to see members un-approve funding measures. With this in mind, the latest NBC News report from Capitol … [+3731 chars]"
Republicans to watch when Trump’s $9.4 billion cut comes to the Senate,"In an age of unprecedented national debt, $9.4 billion is just a drop in a bucket, coming in at about 27 bucks per American. But still — still! — it might not pass the U.S. Senate, where it’s headed after the House of Representatives’ yes vote on Thursday. Th…",https://www.theblaze.com/columns/opinion/republicans-to-watch-when-trumps-9-4-billion-cut-comes-to-the-senate,2025-06-13T15:52:25Z,TheBlaze,"In an age of unprecedented national debt, $9.4 billion is just a drop in a bucket, coming in at about 27 bucks per American. But still still! it might not pass the U.S. Senate, where its headed after… [+7922 chars]"
Effect of active follow-up of women with previous cesarean delivery on uptake of timely safe obstetric and surgical care: Comparison between pre-intervention and intervention cohorts in Rwanda,Introduction The rate of cesarean delivery (CD) in Rwanda has increased significantly from 2.2% in 2000 to 15.6% in 2020. Given increasing risks in subsequent pregnancy following CD it is important that women who have had a prior cesarean section plan and sch…,https://journals.plos.org/plosone/article?id=10.1371/journal.pone.0325884,2025-06-13T14:00:00Z,Plos.org,"Abstract
Introduction
The rate of cesarean delivery (CD) in Rwanda has increased significantly from 2.2% in 2000 to 15.6% in 2020. Given increasing risks in subsequent pregnancy following CD it is … [+30073 chars]"
