title,description,url,publishedAt,source,content
Spatial distribution of stunting among breast feeding children in Sub-Sahara Africa,"Background Malnutrition is still a major global public health issue, especially in Sub-Saharan Africa (SSA), where millions of children suffer from stunting, a chronic form of the disease. In addition to limiting physical growth, stunting also impedes social …",https://journals.plos.org/plosone/article?id=10.1371/journal.pone.0325812,2025-06-13T14:00:00Z,Plos.org,"Abstract
Background
Malnutrition is still a major global public health issue, especially in Sub-Saharan Africa (SSA), where millions of children suffer from stunting, a chronic form of the disease.… [+29854 chars]"
Career Advice For Unemployed Social Impact Workers Hit By Federal Cuts,"US government-related layoffs have impacted thousands of public, private & nonprofit workers concerned with social impact. Advice on pivoting to build a new career.",https://www.forbes.com/sites/davidhessekiel/2025/06/13/career-advice-for-unemployed-social-impact-workers-hit-by-federal-cuts/,2025-06-13T13:36:57Z,Forbes,Many people take jobs in the federal government or with organizations that receive government funding because want their work to create positive social impact. Many such workers have been laid off fr… [+4568 chars]
"""Millions of Lives at Risk"": USAID Cuts Lead to Global Rise in Death, Hunger, Poverty and Disease",Secretary of State Marco Rubio has ordered the termination of all remaining overseas employees of USAID to complete the dismantling of the six-decade-old agency. USAID was an early target of Elon Musk and DOGE. We look at the dismantling of USAID and what it …,https://www.democracynow.org/2025/6/13/us_aid_cuts_international_impact,2025-06-13T12:45:15Z,Democracy Now!,"This is viewer supported news. Please do your part today.
Donate
Secretary of State Marco Rubio has ordered the termination of all remaining overseas employees of USAID to complete the dismantling … [+985 chars]"
"House Approves Bill That Would Claw Back $9.4 Billion In Funding, Now Moves To Senate",The House of Representatives voted in favor of a bill to rescind $9.4 billion in funding for public broadcasting (including public radio and public TV) and international aid.,https://www.forbes.com/sites/kellyphillipserb/2025/06/13/house-approves-bill-that-would-claw-back-94-billion-in-funding-now-moves-to-senate/,2025-06-13T12:34:37Z,Forbes,"WASHINGTON, DC - JUNE 9: The U.S, Capitol Building seen at dusk on June 9, 2025 in Washington, DC. (Photo by Kevin Carter/Getty Images)
Getty Images
As expected, the House of Representatives voted … [+4530 chars]"
Forbes Daily: Israel Strikes Iran As Trump Pushes For A Nuclear Deal,"Friday's Forbes Daily newsletter covers  Trump's Gold Card visa red flags, Chime's shining IPO, Larry Ellison becomes the No. 2 richest, Trump's crypto fortune & more.",https://www.forbes.com/sites/daniellechemtob/2025/06/13/forbes-daily-israel-strikes-iran-as-trump-pushes-for-a-nuclear-deal/,2025-06-13T12:15:52Z,Forbes,President Donald Trump has touted his $5 million Gold Card visa as a way to raise trillions of dollars for the U.S. But a new website launching the initiative doesnt look or feel like a legitimate go… [+8594 chars]
Biggest-Ever Aid Cut by G7 Members a Death Sentence for Millions of People,"Aid cuts could cost millions of lives and leave girls, boys, women and men without access to enough food, water, education, health treatment. G7 countries are making deliberate and deadly choices by cutting life-saving aid, enabling atrocities, and reneging o…",https://www.ipsnews.net/2025/06/biggest-ever-aid-cut-g7-members-death-sentence-millions-people/,2025-06-13T11:06:14Z,Inter Press Service,"Africa, Asia-Pacific, Development &amp; Aid, Economy &amp; Trade, Featured, Headlines, IPS UN: Inside the Glasshouse, Sustainable Development Goals, TerraViva United NationsOpinion
Credit: United Na… [+7271 chars]"
How Trump’s Obsession With Weight Explains His Misrule,"When President Donald Trump addressed Army troops June 10 at Fort Bragg, his audience was screened for political leanings and physical appearance. “No fat soldiers,” read one unit-level message, according to Konstantin Toropin and Steve Beynon of Military.com…",https://newrepublic.com/article/196784/trump-obsession-weight-explains-misrule,2025-06-13T10:00:00Z,The New Republic,"When President Donald Trump addressed Army troops June 10 at Fort Bragg, his audience was screened for political leanings and physical appearance. No fat soldiers, read one unit-level message, accord… [+1891 chars]"
"An AIDS orphan, a pastor and his frantic search for the meds that keep her alive","In the wake of U.S. aid cuts, Pastor Billy is reminded of his twin sister's death from AIDS. He doesn't want 9-year-old Diana, who's HIV-positive, to meet the same fate.",https://www.npr.org/sections/goats-and-soda/2025/06/13/g-s1-70964/trump-africa-hiv-aids-orphan-usaid,2025-06-13T09:00:00Z,NPR,"Night had fallen hours ago, but Billiance Chondwe was not slowing down.
On Feb. 20, he frantically tapped out texts on WhatsApp, dialed distant acquaintances and left voice messages from his home in… [+23923 chars]"
"House Approves $9 Billion in Funding Cuts Affecting NPR, PBS and Foreign Aid - The New York Times","House Approves $9 Billion in Funding Cuts Affecting NPR, PBS and Foreign AidThe New York Times House votes to claw back $1.1 billion from public mediaNPR House GOP narrowly approves $9.4 billion package of DOGE cutsCNN Elon Musk's USAID cuts pass in the House…",https://slashdot.org/firehose.pl?op=view&amp;id=178035583,2025-06-13T06:14:59Z,Slashdot.org,"I think there's a world market for about five computers.
-- attr. Thomas J. Watson (Chairman of the Board, IBM), 1943"
"Winning: House Passes Rescissions Bill With Massive Spending Cuts, Package Moves to Senate","On Thursday, the United States House of Representatives narrowly passed the first rescissions package, which will eliminate billions in unnecessary spending by the federal government. The bill will now go to the Senate, where it requires only a simple majorit…",https://freerepublic.com/focus/f-news/4322763/posts,2025-06-13T05:11:12Z,Freerepublic.com,"Skip to comments.
Winning: House Passes Rescissions Bill With Massive Spending Cuts, Package Moves to SenateRed State ^
 | 06/12/2025
 | Ward Clark
Posted on 06/12/2025 10:11:12 PM PDT by SeekAnd… [+4953 chars]"
We Are Being Amused and Abused to Death,"“But we had forgotten that alongside Orwell’s dark vision, there was another—slightly older, slightly less well known, equally chilling: Aldous Huxley’s Brave New World. Contrary to common belief even among the educated, Huxley and Orwell did not prophesy the…",https://www.lewrockwell.com/2025/06/jim-quinn/we-are-being-amused-and-abused-to-death/,2025-06-13T04:01:00Z,Lewrockwell.com,"But we had forgotten that alongside Orwells dark vision, there was anotherslightly older, slightly less well known, equally chilling: Aldous Huxleys Brave New World. Contrary to common belief even am… [+20411 chars]"
