title,selftext,subreddit,author,created_utc,url,score,num_comments,keyword
I don't know how to title this ...,"I don't know if I've tittle this correctly but ...., I'll just write sometimes all you have is pen and paper and in my case a laptop ,Wi-Fi and reddit will do , lol.

I'm in my mid thirties for context. 2 years ago I embarked on a journey to create employment not only for myself but possibly for the people around me in my community and globally. A girl can dream right. My thought process was we consume a lot from the western world and all other areas of the globe but what do they consume from us directly? They have platforms and avenues where they can sell arts crafts and all kinds of creations straight from their backyards or garages and make really good money and sustain their livelihoods'. I was like you know what, we have all these hand crafted stuff that they pay top dollars for why cant we create platforms or channels  where our local artisans especially east Africans can market and sell their artifacts to the world and make their money ? 

I also had an idea to build a digital product one that defies borders, wipes them out completely and turns the world into a true global village, put real connections right at our fingertips. Just Imagine the infinite doors this could open mixing cultures blending Ideas people from totally different worlds working together with the possibility of creating honest income. A girl can dream. besides mobile money transfer originated from Africa, Kenya to be precise.

One thing about it that's not two, dreams need actions to actualize, to actualize one needs resources.  Resources can be monetary but in my journey I've come to realize resource is a heavy packed word. A roof over your head , a meal , health care , moral mental ,emotional support all are vital resources when it comes to building on as well as actualizing our dreams. For the past one year I've been running on fumes. last week Monday had to give up all my possessions for auction, the last thing I have to my name is my laptop. by end of day today I will be homeless as my landlady gave me notice to vacate .

I tried setting up a go fund me ... funny story the hoops and loops one has to go through smh. 

I tried UFANDAO guess what they expect you to give first to receive and you know what you cant donate to African causes literally. when you try you find you're blocked from donating to any African causes 

And then there's PayPal that treats receiving money in Africa like a conduit to funding terror groups or money laundering. Try creating [Paypal.me](http://Paypal.me) let me know how it goes if you're in Africa.

There's a chihuahua somewhere on these fundraiser platforms that's probably garnered over 10 thousand USD in donations while I have to pay for my fundraiser to go live ... diabolical. I don't have it but I somehow have to have it to get help I need to have it ? I'm confused lol. 

My mental health is probably in the dumpster somewhere, but lets assume that for now, if I ignore it long enough it probably wont exist.  

What am I saying ? dear Africa we have the capacity resources brains skilled labor  and everything else in-between to create a self sufficient continent. we let the western world take soo much from us while they give literally nothing back but religion and a dream that our riches are in heaven while actively enjoying our tangible resources to make their lives easier and better. 

Wake up Africa , for how long will you be complicit in  your own erasure ?  ",Kenya,ComfortableStop4431,2025-06-07 05:30:38,https://www.reddit.com/r/Kenya/comments/1l5dc2r/i_dont_know_how_to_title_this/,4,2,usaid kenya funding cut
Anyone here using Alibaba to import goods into Kenya?,"Many Kenyans are turning to Alibaba to source products cheaply from China — things like electronics, clothes, kitchenware, and more. Whether for resale or personal use, the platform offers lower prices than local markets. But importing is not as easy as checking out online.

**Shipping:** You can choose air freight (fast but expensive), sea freight (cheaper but takes 30–40 days), or courier services like DHL (fast but very costly). Sea freight is more economical for bulk orders, but it needs patience and paperwork.

**Payments:** Alibaba offers Trade Assurance (like an escrow), which protects buyers until goods arrive. Alipay is another option, and recently, M-PESA started working with Alipay — which is a game-changer for small Kenyan buyers. Still, some suppliers prefer bank transfers, which feels risky for first-timers.

**Customs:** This part can be tricky. KRA charges VAT and import duties depending on what you’re bringing in. Some people have had shipments held because of unclear paperwork or surprise fees. Freight forwarders can help, but they also charge their cut.

Then there are risks: fake suppliers, poor-quality items, delays, and no recourse if you didn’t use Trade Assurance. Some people say it's worth it, others have horror stories.

So I’m curious — has anyone here successfully used Alibaba to import to Kenya? What were the challenges or wins? Any tips for shipping, payments, or avoiding scams? Let’s share some local knowledge!",Kenya,Suitable_Article_574,2025-06-04 20:40:07,https://www.reddit.com/r/Kenya/comments/1l3ggpi/anyone_here_using_alibaba_to_import_goods_into/,6,6,usaid kenya funding cut
Parent that has the financial ability but isn't being supportive...,"I've been raised as the only son. My dad actually has a good position in a very good company here in kenya. We even get free medical cover because of him being a staff in that company. He was employed when he was 19 years and he then went for higher learning and grew through the ranks until where he is today. 

When I was back home in a city in kenya, I wont mention, my neighbours used to think that I'm a rich man's son, and that I was pampered and all that. The truth is the only things I got from my dad were simple things. I can't even name a shoe or a clothe that he ever bought for me or anything. If I passed my exam, I was just told it's ok. Nothing happens. 

My dad just cared about paying school fees and anything that relates to it. Those other things, no. I remember there was a time when I was in std 6, he completely refused to buy me shoes. I was walking with completely torn up shoes. The shoes looked like they could talk to your friend and ruin his entire day. 

That day, I got so angry and I did the unspeakable. I took cement from the store and poured in his well polished shoes and went to school. I was never the troublesome kid. I was just that kid who was calm, passed exams and loved cartoons. I was like a role model to some kids. I was always the 'nice' kid.  I just did that out of anger. The kids of the father's who worked with my dad seemed to live good lives as compared to my pathetic life.

My dad actually owns a business, land, and rentals in two cities. The rest I don't know. He is also a drunkard. From when I was young I just avoided borrowing him money because he would never give me. I used to just borrow my mom and when she doesn't have, then I just understood because she has a small business. My dad is much superior to her financially.

We also don't pay rent because we live in my dad's property. Now, let me go to my main topic. I studied smart and ended up completing my degree. So I became one of the unemployed youths for sometime. Within a month I got a casual job. The casual job was a continuous one, 24/7 but I used to work at night.

So I was to stay alert at night and sleep during the day. The job paid averagely and I can't complain. It wasn't a hard job too. So it came to an end in December. From then, I was unemployed. I was doing every kind of gig and every kind of thing just not to go home. I reached a point where I was capable of illegal activities like fraud but I didn't do them. I fear DCI. By that time, I'd sometimes tell my dad nimelemewa but the old man just wanted me to go home.

I'd tell him that, and I'd have to disturb him for days only for him to send 150 kes. I just knew I was a partial orphan. So last month but 1, I told him I'd go back home because I had suffered enough. My friends told me to continue pushing and that some day things might get better. What gave me hope was the interviews I got. I used to walk to those interviews because I had no money. I mean long distance journeys.

There was a time I was very sick. I told my old man and he just told me to go to the hospital. I had no money and he didn't send any. I just told my mom and she sent 300 kes and told me to use it as transport and in case of anything I should call her. My dad went ghost mode and called me after a week, only to send me 500 kes. He just asked if I'm ok and I said no and that's what he did.

Today, what broke my heart was how he responded to my call. I'm his only son so I really don't know why he just acts like I'm not human or what. I got a job on Tuesday. A casual one. But, the fare is 80 kes. I mean 80 kes in the evening and 80 kes in the morning. I work at night.

I just called him since I know it's that time that they've already been paid. I told him to only send me fare to go to work today. I also told him that I had not paid last month's rent and the landlord is on my neck. You know what he said? I know you've already guessed right. 

He was like, "" 'James' (not my real name) hebu omba mama yako. Mimi sina pesa kabisaa"". Then I told him that I had borrowed my mom countless times. I have even taken loans from my friends and even the banks, and fuliza but he just said, ""mimi sina pesa. Kopa mama yako alafu umwambie utamlipa"". I just heard that and cut the phone. 

You can also imagine that he has blocked me in all his numbers except one. If he blocks that one number then I'll never be able to contact him again.

I'm just feeling so low. When will life go my way. I don't remember a day that I had a decent meal. You can also imagine I'm a casual worker and it's not that easy when you're not eating well. I'm so tired and maybe I was just born into the wrong family. I just wish I can get that fare before evening because not going to work is also depressing.

I swear I'll never let my children experience this. I'll support them till they get financially stable. I'll do that shamelessly. ",Kenya,Chainzzz1543,2025-06-01 05:21:30,https://www.reddit.com/r/Kenya/comments/1l0h5jg/parent_that_has_the_financial_ability_but_isnt/,25,49,usaid kenya funding cut
Receiving money in Kenya,Hi guys. First post here. I’m a Ghanaian try to send my friend some money. Things are tight and I’m just trying to help. I’ve been to Kenya twice but I’m currently not in the country. Anyone with an idea on how I can send funds from my account to his account or MPESA. Thanks,Kenya,Dapper_Price7069,2025-05-31 14:14:14,https://www.reddit.com/r/Kenya/comments/1kzy2x0/receiving_money_in_kenya/,11,34,usaid kenya funding cut
Missgivings of AfriCOG and Okoa Uchumi's(TISA) in their latest report - Stealing the Future,"Link to doc -> https://africog.org/wp-content/uploads/2025/05/Stealing-the-Future.pdf

**1st** missgiving are pleadings and/or pandering to defunct/institutions seeking relevance, since ~1973, referred to as Bretton Woods. No country has ever come out of their ""Structural Adjustment Programs(SAPs)"" stronger economically, socially or politically.

**2nd** is a great ignorance of how modern monetary system works. Kenya needs NOT borrow in foreign currencies as she has her own called the Kenyan Shilling(KES). These borrowing expose serious structural problems in the jurisdiction called Kenya.

**3rd** is an austerity bias for fiscal policy which is an echo of Bretton Woods advice. KE gov't, entity with 22-23% of GDP, has recently cut her spending by ~2% of GDP or KES ~400 Billion. Results have been growth figures of 4.6% & 4.0% respectively for 2024 fiscal quarters Q1(July - Sept 2024) & Q2(Oct - Dec 2024). KNBS has refused with Q3 data i.e Jan - April 2025. Does any Kenyan want a continuation of this? Macro-Economics 1st/**golden rule** is that one sector's spending is another's income. Cut spending, cut incomes, cut output and finally employment.

**4th** is a complete ignorance or denial of Balance of Payments(BoP). It's NOT just here but also in recent talks, a running theme?, hosted by University of Nairobi where there's little mention of this - https://www.youtube.com/watch?v=b3tifBvwAfo . Report launched in the livestream - https://documents.worldbank.org/en/publication/documents-reports/documentdetail/099052625075532839 . Fiscal sustainability ""problems"" as we've established are frankly **nonesense** as KE has & is the monopoly of her own currency. It can never run out of it! It's ONLY KE gov't that can *print*/issue this currency! Just try and counter-feit KES & you'll see magnitude of charges racked against you! At ratios  of ~200+% for external(foreign currency) public & publicly guaranteed(**PPG**) debts to exports this isn't sustainable! Source for this is KE Treasury's Draft MTDS(Medium Term Debt Strategy) for 2025 page 20 - https://www.treasury.go.ke/medium-term-debt-management-strategy/. Capital accounts supposed to counter the current account(trade deficits) are very weak.

**4.1** Certian items, food/core staples, in current account(part of Balance of Payment's) are specifically worrying. Imports are definitely a plus as they build onto what KE produces(*KE's pile of stuff*) however on key/strategic issues it's NOT feasible. Food/core staples represent ~17% of total imports & are valued at USD ~5 Billion or approx ~8 months of fuel/energy related imports. These are **National Security** items which is shocking the ideology/philosophy being adopted that of *food security*(you can buy your food) Vs **food sovereignity**(you must produce your own food). I discuss this in a recent comment & the frauds/damned lies Vs reality - https://www.reddit.com/r/Kenya/comments/1kmg8ye/we_never_learn/mslfbsk/

**4.2** I'd dare say the syndicated borrowings, Eurobonds & so termed budgetary support by IMF are directed to these 2 huge items that take ~30% of all imports i.e food and fuel.

**5th** is about flows of corruption/theft popularly given a figure of KES ~2 Billion daily. Well these monies are entering/remaining & swimming around in KE's financial/monetary system. ""Borrowings"" in local currency are the same as taxes & other **impositions**. They are **ex-post** i.e happen after the fact. With ~800 Billion in pending bills and weak capital accounts(no.4 above) there's NO other source that can explain the bid-cover ratios seen for issues and re-openings of short(t-bills) & long tenure(Infrastructure bonds etc) gov't securities.

**5.1** More supporting evidence of the above stolen/pilfered funds swimming around in the same pond. [Commercial] Banks have seen huge & consistent growths of their **liability** side i.e customer's **deposits** to the tune of 6.7 Trillion or 19.3% of GDP in 2024 from 5.2 Trillion in 2023 and 4.1 Trillion in 2022. These mandated sources of capital(deposits), by CBK, are both NOT costless & risk free(bank runs) hence banks must invest/park them in risk free & stable vehicles to offset their risks & operational costs. This is the popular trope that *""banks thirst for gov't debt""* or *""banks are lending to gov't and not private sector""*. But where are these deposits coming from given the two sources above being insufficient or curbed? No money gets lost in a system!

**5.2** There's nothing like a crowding out of private sector in a country running deficits of ~6-7% of GDP. These are **risk-free** & **stable** assets to **private sector**! What is evidenced here is a **distributional problem**(in soft language) or if like outright theft!. A continuation of the 1970's and 1980's second crisis of Economic theory between the two Cambridges.

**6th** Is a dismisal/lack of appreciation NOT only voiced in this document but by many prominent Kenyans. It's statements that KE gov't MUST get the hell out of the way. This includes basic and/or **natural monopoly** items such as energy, critical infrastructures for communication & transport etc. The characterization is that gov'ts do NOT produce and/or stimulate anything. That ""markets"" always ""stabilize""/get things back into **""equilibrium""** by themselves. I do NOT know if this comes from KE churning out only output & expenditure-based statistics of **National Accounts**. For the latter gov't or institutional sectors data is NOT yet compiled - 2. Methodology from https://dsbb.imf.org/e-gdds/dqaf-base/country/KEN/category/NAG00. **FYI** You can calculate GDP via 3 approaches - **Income**(sources of funds), **Expenditure**(uses of funds) & **Output**(production of goods/services). To dispell myths that gov'ts are nothing but leaches there is Mariana Mazzucato's book - **The Entreprenurial State**.

**7th** Last but not least is classic identification/pointing out of a problem without any solutions by **AfriCOG & TISA**. Exchequer releases/**gazettements** that happen ~1-1.5 months are NOT adequate. They must be more frequent(daily statements like US's Daily Treasury Statement aka The **DTS**) and more granular(dis-aggregation/lower levels below **vote heads** showing things like receipts, invoices etc). There's a system in the works if you listen to **KE Treasury** & associated folk however recent history does NOT bode well. I'm talking of the stalled/failed **digital land registry system** dubbed **""Ardhisasa""** that has largely ground to a halt after it's pilot phase. Can we expect anything of the pending/yet to be implemented **Treasury Single Account**(TSA) system by KE gov't? ",Kenya,AdrianTeri,2025-05-30 06:25:36,https://www.reddit.com/r/Kenya/comments/1kyx837/missgivings_of_africog_and_okoa_uchumistisa_in/,1,1,usaid kenya funding cut
Give your sons inheritance.,"
I’m a misogynist because of my mum. It’s from her that I learnt phrases like 🚨 “a woman is not your friend”, “make money because women disrespect men without money ”, “kazi yako ndio mke wako wa kwanza.”
 
She also gave me my first two acres 💰 even without asking. What made the whole thing special 💐 was that she had inherited the land from her mum and she directly gave me the same land—something many African/Luhya women would never do.

She of course took me to private schools 🏫 both primary and university to ensure that I get the best. She ensured that when I was applying for my passport that I’d get it fast 💨 so that I could travel 🧳 easily. She is the reason I have very high standards.

My 🤩 mum empowered me because she is a woman and she knows what women are capable of.
She understood that it’s only with such moves that she’d ensure my financial stability as well as freedom from both my sisters and any other woman 👩‍🦱.

Here is to the mums in this group: empower your sons—after all, you know what your fellow women can do and you have examples of that. 

And kudos to my 🫡 mum for setting up the bar.

Edit: this post is sarcastic and from the looks of it it went over many peoples head. why do we need to have gender wars based on other people actions yes there are bad men and women out here but there are also good men and women just choose wisely, respect yourself and have boundaries, if somebody crosses be ready to cut them off .

https://www.reddit.com/r/Kenya/s/GEBKcJU3nx

Mkue na literacy skills ya ku understand literature.",Kenya,Big_Run_4859,2025-05-28 22:07:26,https://www.reddit.com/r/Kenya/comments/1kxu2iy/give_your_sons_inheritance/,84,82,usaid kenya funding cut
The Star today,Eh! ,Kenya,ForsakenTumbleweed40,2025-05-27 08:49:21,https://i.redd.it/j5ws7z3sfa3f1.jpeg,5,5,usaid kenya funding cut
Alleged Abduction of Kenyan MP George Koimburi Amid Political Tensions,"On 25 May 2025, George Koimburi, Member of Parliament for Juja, was allegedly abducted outside the Full Gospel Church in Mugutha, Kiambu County, Kenya, by unidentified individuals and was found the following day, injured and unconscious, at a coffee plantation in Ruiru, approximately 10 kilometres away. He is currently receiving medical treatment at Karen Hospital in Nairobi.   
  
The National Police Service (NPS) is investigating the incident but denies involvement, asserting that Koimburi was under investigation for alleged land fraud and misuse of Constituency Development Funds, having evaded arrest on 23 May. The NPS also suggests Koimburi may have staged his abduction, though investigations continue to establish the facts. Koimburi, a vocal critic of President William Ruto and an ally of former Deputy President Rigathi Gachagua, was previously arrested in February 2025 for allegedly forging academic qualifications, a charge he denies.  
  
Opposition leaders, including Kalonzo Musyoka, condemned the abduction and expressed concerns about the safety of public officials, highlighting broader issues of political harassment. This incident follows a reported wave of over 80 abductions in Kenya since June 2024, which the Kenya National Commission on Human Rights attributes to state security agencies, though the government denies involvement. 

Any thoughts?",Kenya,Super-Concert-2859,2025-05-27 06:56:35,https://www.reddit.com/r/Kenya/comments/1kwgsgy/alleged_abduction_of_kenyan_mp_george_koimburi/,2,3,usaid kenya funding cut
Amazing scientific facts,"Leo wacha tuongelee astrophysics. The speed of light is the fastest thing in the universe.light travels at almost 300,000 kilometers a second, so this means that if you were in a spaceship moving at that speed you could circle the Earth nearly eight times in just a second. what's even crazier is at this speed you could get to the moon in just 1.3 seconds or even Mars in just three minutes even with it being roughly 55 million kilometers away. what if you want it to cross the whole Milky Way?  it would take an insane 200,000 years at that speed to cross its entire length . on top of that if you wanted to travel beyond our galaxy and to our closest neighbor Andromeda Galaxy this would take you  two and a half million years and if you tried visiting the edge of the observable universe you would never arrive since the universe is expanding faster than light itself. Kama sio mzungu discoveries kama izo tungejua kweli? Let alone the advance that AI has made in recent years,from self driving cars that can mine to  coding entire apps. Meanwhile in Africa,  kama apa Kenya eti we don't have enough funds for national exams? Corrupt and incompetent leaders have kept Africa dedicates behind in technology and  real education.  Next you're voting for your leader, vote responsibly because we are part of the problem. Or we go Burkina Faso way😂. As malcom X used to say, we must to what it takes to make sure that the revolution is successful, even if it means shedding blood.",Kenya,Vast-Opportunity1952,2025-05-25 10:48:58,https://www.reddit.com/r/Kenya/comments/1kuzpdh/amazing_scientific_facts/,4,6,usaid kenya funding cut
"Abortion in Kenya: A Clash of Policies, Culture, and Beliefs.","Let’s cut through the hypocrisy.

You’ve heard the sermons, the moral grandstanding, the “pro-life” slogans. Meanwhile, 2,600 Kenyan women die yearly from unsafe abortions—and it’s not because they’re “immoral.” It’s because our laws, foreign meddling, and stigma are failing them.  

Here’s the brutal truth: 

1. The Law is a Trap

- Constitution says: Abortion is legal to save a woman’s life or health (including rape/incest).
 
- Penal Code says: Abortion is a crime. Providers face 14 years in jail; women, 7 years.

- 2023 Malindi ruling: Courts called this BS, affirmed abortion as a fundamental right. But MPs and cops still harass providers and patients.  

Translation: If you’re raped, you must beg a doctor to risk arrest to save you.  

2. Unsafe Abortions = Silent Epidemic

21,000 women hospitalized yearly from botched procedures (think: bleach, coat hangers, quacks). 

Cost of “choice” 

  - Safe clinic: 20,000 KES ($160) – more than most earn in a month.  
  - Backstreet hack: 2,500 KES ($20) – and maybe your life.
  
Who dies? Poor women. Always.  

3. The U.S. is Fueling This Disaster

 Trump’s Global Gag Rule slashed funding for clinics offering abortion info. Result? Closed health centers, fewer contraceptives, MORE unsafe abortions.

 Kenya’s Ministry of Health caved to U.S. pressure, scrapping safe abortion guidelines in 2013. Courts ordered their return—still ignored.  

Fun fact: U.S. Christian groups fund Kenyan anti-abortion lobbyists to push their agenda.  

4. Stigma Kills More Than Laws

“Crisis pregnancy centers” (funded by U.S. evangelicals) lie to women: “Abortion causes cancer!”

Religious leaders shame survivors of rape: “Carry the baby—God’s plan!”

Doctors refuse care, fearing arrest or judgment.  

What You Can Do

1. Demand MPs reform the Penal Code– Align it with the Constitution.

2. Donate to RHNK(Reproductive Health Network Kenya) – They train providers and fight for rights.

3. Call out stigma– Share facts, not sermons.

4. Comment below: “How would YOU navigate this system if you were a pregnant rape survivor?”

“This isn’t about ‘morality’—it’s about power. Who controls women’s bodies? Politicians? Preachers? Or WOMEN THEMSELVES?”  

Edit:To the trolls: Save your Bible verses. This is about Kenyan lives.  ",Kenya,21_Garbage_,2025-05-25 07:44:53,https://www.reddit.com/r/Kenya/comments/1kux1y4/abortion_in_kenya_a_clash_of_policies_culture_and/,9,2,usaid kenya funding cut
