title,selftext,subreddit,author,created_utc,url,score,num_comments,keyword
"USAID left a month ago, do we have ARVs in Kenya?","Someone on a different group (different website) was asking if now that USAID is gone, does kenya still have ARV medications? Like can people go for PEP? or those who are infected are they still getting their meds???

  
If not then we are about to enter an epidemic, where people infected start infecting others at a higher rate. Since for many people, when taking the medications they were less risk of infecting others.",Kenya,muerki,2025-04-15 13:16:53,https://www.reddit.com/r/Kenya/comments/1jzrn2s/usaid_left_a_month_ago_do_we_have_arvs_in_kenya/,3,5,usaid kenya
Classism in r/Kenya and r/nairobi,"The classism I'm seeing in both subs is a good example of some of the current society. Honestly, it is sickening. A week does not pass before seeing some classist posts by a few people. The sad part about this classism is that most of these people are not rich rich. If they got sick, they would probably end up in debt or selling their stuff, ama watengeneze posters za M-Changa. An observation I have made is that most people here are middle class, kids from middle-class families na watu wameshika pesa juzi juzi. Most people here ni wale hawajapitia ile season you lack things or life is not going well. Fair enough because most people here are employed so they have job security.

The other day, we had some guy talking about cheap perfumes and how they irritate him, as if everyone can afford designer perfumes. Mindless rumblings about matatus sijui ziko na nini, someone else was going on about makangas yet when Super Metro was suspended, everyone was suddenly an expert on public transport supporting collective punishment. Wewe kama matatu zimekushinda nunua gari yako. Can we talk about some of the silly rules wengine wenyu mko nazo, rules tu za ujinga that show how hii illusion ya pesa kidogo has consumed most of you people. Yani small small moneys have most of you guys shitting on others. Sasa umepata pesa juzi juzi unaona unaeza ambia watu by a certain age wanafaa kua na certain achievements. Yani mnadharau mtu juu anasema KFC ni watu wako na pesa. Now all of sudden you have money, umesave 200k youthink other people are lazy, mnaanza kuignore your struggling friends wakipiga simu mkiwawekea rules mpaka za kuwapigia or visit. This is not normal.

In my line of consultancy work, I've met very influential people, rich men and women with big cars and thousands of acres of land. The common factor in most of them was their humility. I encounter classism every day on X but ya reddit imeanza kua worse, borderline narcissistic ata. I never expected to see it among a redditors who claim to be better than people who use other social media apps, which is funny juu hakuna difference kubwa between watu wako huku na X, or even Facebook or Tiktok. Most of you guys need to learn that Kenya is a poor country. Don't let living in a 20k or 50k apartment make you arrogant. The classism here ata mgeni akikuja atafikiria Kenya is a MEDC where almost everyone is rich with a high income. The reality ni most of you mko a disease away from poverty, even if you have insurance. Pesa huisha, life changes. On LinkedIn, I saw a video of a woman who was affected na USAID cuts, akisema vile she felt lost and how she was adjusting to life. That is the reality for most of you, especially na hii economy ya kasongo. In 2022, I was averaging 250k per month before I closed my business. The next thing I knew, my world was falling apart saizo niko na bank loan ya kumaliza. Life humbles you outlook yako ya life inabadilika sana.

I have a friend wako na 90 acres Limuru na majani chai na vegetables, and this guy got an internship kusaidia watu Mathare, and his outlook in life changed completely. This is a guy from an influential family, a respected medical doctor and professor, successful by their own right. We are talking about mtu alipata cancer, akaenda majuu, stayed there and finished her treatment na akarudi Kenya, and the family did not go broke. Most of you need a similar experience muache kuona watu wengine kama sio watu because they are not doing enough before your eyes. Being classist and you do not own any significant capital or other factors of production is crazy business.",Kenya,Morio_anzenza,2025-04-07 04:21:12,https://www.reddit.com/r/Kenya/comments/1jtcvbx/classism_in_rkenya_and_rnairobi/,169,95,usaid kenya
EX-USAID people!! Let's talk,"Are you still in contact with the organisations that benefited from USAID? Icame across the following grant this morning and it aligns with something I had propose to a local nonprofit but they aren't serious. Let's talk asap, the deadline is 7th.

https://creativitypioneersfund.org/opencall

My pm is open, we schedule as from tomorrow morning and be done with this come 9pm. Let me know, regardless of where you are in Kenya. ",Kenya,vindtar,2025-04-05 19:09:10,https://www.reddit.com/r/Kenya/comments/1jsb149/exusaid_people_lets_talk/,2,2,usaid kenya
Why western powers back Israel no matter what and Kenya should avoid being a useful idiot,"I don't care what good book you read, but it's clear that Israel is a settler colonial state, The Bible is not a land deed ,never has been and never will be but this post is not about Israel anyway rather it's about what Israel represents and why the West is backing Israel to the hilt but for that we have to go back to 2020 during the COVID crisis.

In 2019 there was a report done that showed that the US and the UK are the two countries that are best prepared for a global pandemic. That was just a theoretical study that was soon put to the test and it showed how horrible these countries were in times of a pandemic, the US led in deaths at over 1.2 million and the UK, despite having a small population came in sixth with about 220 k deaths. Forget the Hollywood movies whereby an American scientist saves the world, this was real life and in real life, Russia developed the first vaccine and took a jab at the Americans calling it Sputnik V. The Russians were rekindling an old wound and reminding the Americans that just like many decades ago they had been the first in Space.

Come 2021 and there was the American withdrawal from Afghanistan. The chaotic withdrawal from Afghanistan was another blow to the American psyche, as the Americans fled, Taliban gunmen with their sandles and often just armed with their AK-47s followed,  it was quite a picture, this was the most powerful country in the world and it had just lost to a bunch of simple farmers ,it must have rekindled memories of Vietnam where the Americans had fled in a similar manner almost 50 years ago.

Then came February 2022 and Putin sent his armies across the Ukrainian frontier ,now this necessitated a reaction ,the western world needed to remind the world who's boss and so they did try. They imposed some of the worst sanctions on Russia and expected economic collapse in short order but alas, it never came. China and India threw their weight behind Russia and this has been enough to counterbalance the sanctions, the Russians even started getting weapons from countries like Iran ,and these weapons were not some innefective toys, they were terrifyingly effective. When the economic front wasn't working they began sending weapons ,offensive weapons and they seemed to have believed their own propaganda which is basically : Any non-western technology = bad, western technology = good. But their wonder weapons were laid to waste and brought back to Russia, another humiliation. But more was to come.

On Oct 7th 2023 at dawn Hamas fighters launched one of the greatest attacks ever on Israel, Israeli divisions in the South disintegrated in the face of this attack and Israel was utterly humiliated, they had just been humiliated by people they had kept under a 17 year blockade and surveilled every section of the border, their high walls and tech just disappeared and was laid to waste. Images of Israeli soldiers crawling and being dragged out of their tanks scattered all over the Internet. This was a bridge too far and Israel and more importantly it's backers i.e the west felt that something had to be done , these people had to be shown who's boss. And so they wrote Israel a blank cheque to do whatever it wants ,Gaza was where they would reinstate their position and Gaza was to pay for all the humiliation of the last 3 years.

A few weeks ago, there was a conference of antisemitism in Europe, that conference was attended by all sorts of parties in Europe, almost all right wing and many zionist jews refused to attend after seeing these parties were attending. They have caught on that they are in bed with snakes, these parties aren't attending because of genuine concern for any jews ,they are allying with Israel because their supporters just like seeing dead arabs and Muslims i.e they are racist. Even the Republican party in America suffers from this phenomenon too. On one hand these parties blame the jews for the uncontrolled immigration,degeneracy and decline in family values in the west and on the other hand they claim to fully support Israel. These people only love the jews when they're killing Arabs which fulfills their racist desires. It's their useful idiot in the middle East.

Kenya and particularly Kenyans should avoid being useful idiots, I've noticed Kenyans like to parrot right wing talking points particularly those that touch on christianity, a Kenyan who's children are probably vaccinated on USAID money will say Trump is great because he is anti-LGBTQ.  You'll find the average Kenyan calling Houthis terrorists and even supporting the construction of a drone base in Kenya to strike the Houthis  ,Houthis that have never in any way shape or form attacked Kenya. Btw this useful Idiocy is what brought Al Shabaab to our borders,  Ethiopia ,another useful Idiot was used by the US to invade Somalia and topple the Islamic courts union (ICU) government, not because the ICU posed any danger to the US but because the Americans claimed that the ICU may one day become like the Taliban and now here we are. Who knows maybe 40 yeard from now the CIA will declassify a memo that showed that the US just wanted to test whether 3rd world countries would be an excellent substitute for American and NATO forces in the war on terror. In other words we are stuck with Al Shabaab because the US wanted to conduct an academic study.

",Kenya,Gold_Smart,2025-03-25 08:18:04,https://www.reddit.com/r/Kenya/comments/1jjehwq/why_western_powers_back_israel_no_matter_what_and/,13,20,usaid kenya
Is kenya capable of funding its needs now that USAID has been disbanded?,How is kenya prepared to fill the vacuum of USAID assistance? ,Kenya,westmaxia,2025-03-08 08:08:58,https://www.reddit.com/r/Kenya/comments/1j6cjze/is_kenya_capable_of_funding_its_needs_now_that/,1,6,usaid kenya
Ignorance or malice?,"I have just watched the MP of Homa Bay defending Trump, saying the reason he does so is because of his stand on LQBTQ+ rights.

Trump is the same man who called African countries shithole countries, and is currently trying to end USAID. Correct me if I'm wrong, but does Homa Bay not have the highest rates of HIV infection in Kenya. Shouldn't he want organizations like USAID to keep on working in healthcare, since they supply ARVs and other stuff for cheaper rates than if we went out there and bought them ourselves.

Si nilidhani MPs are supposed to care about constituents ama. But maybe i shouldn't attribute to malice what can be explained by ignorance. Hadi LGBTQ rights in the US zinamwaffect aje in a largely homophobic country?",Kenya,Typical-Champion-370,2025-02-12 04:49:42,https://www.reddit.com/r/Kenya/comments/1inj4k3/ignorance_or_malice/,0,8,usaid kenya
USAID woes,"many people don't know how USAID made many Kenyans rich and enabled some to manage a better life(financially and health-wise) lakini saii it's visible 

Almost 500k Kenyans(households) are set to lose their source of livelihood, diseases are about to spike in Africa which could've been prevented via vaccination which was funded by USAID lakini Trump ni nani

Although I don't advocate dependency as a country this one will however have a serious effect on Kenya and Africa as a whole considering corruption crisis as whole

Lakini someone said if our president can renovate the state house with billions then he also has the ability to fund the most important program ""Children Vaccination Program"" sio tu kuleta mapastor wazungu huku. 

either way the effects itaonekana before hii mwaka iishe

but real talk, Has there ever been a good US president?... who's just human for human?",Kenya,_KingCleo,2025-02-07 16:10:26,https://www.reddit.com/r/Kenya/comments/1ijyka5/usaid_woes/,2,9,usaid kenya
Karibu na mzuri! A day in the life of a job seeker.,"Sijui  niite bahati ama kuponea chupu chupu. Nimeitiwa hustle flani nikiwa hapo CBD , nayo mimi afisa mtiifu wa Generali Shillingi ya Kenya nikareport post . post ilikua hapo kamukunji.  I was given a days contract as clerk wa kudistribute  ""jst arrived"" USAID relief food , in my mind I was like this is God , I arrived in town that morning for an interview ya izi mboka za gulf .Anyways kijana nimepiga m&s zangu  za pale T2 safi , navy blue pants n a white shirt, chini  nimefunga hesabu na dark brown boots , Clarks flani I scored gikomba na bei ya Sunday (btw Sunday bei NI ya -wananchi-) .

Alright post pleasantries tume exchange na mama Mikey, ( shes the one who called me in )  nikaonyeshwa desk na mine forms pale tayari , lakini si mnajua Tu mambo ya hii serikali msongo, relief food kwa TV walishapiga picha za exchange handshake, lakini kwa ground Lori ya mikate ndo imefika pekee sasa NI tutegee Lori ya unga na mafuta iko hapo' Uhuru highway'.  

20mins wait ishageuka 3 hrs , ata wenye walikua wamekujia hio aid ikabidi warudi home na hustle kidogo afu wakam mabadae, Mimi nilitoka kwetu malaa 5:30 morning ndo nimake interview ya 8:00 anniversary towers, so pale kwa desk ya mine nishaanza kudrool , si fault yangu men, Kiti ilikua billionaire barn mesh , very comfortable thing ,miguu pale juu ya acquisition form za wenyewe,nikua Nishaanza kuota vile sasa hao clients na investors WA Kai and Karo wamehamia sasa kwa kampuni ya mine long story short niliamshwa na sauti ya glass wall ikimwagika, lakini vile hio sauti ilikua karibu I dared not open my eyes Mimi NI mgonjwa wa macho am keen to protect my eyes more than am eager to see whats happening.

I could feel pieces of glass trickle down my body as if I did sweat silica ,turns out Mike my bosses son was skating around his mom's empty office before he went through the glass wall, I was left  with scratches but two deep cuts on both of my fore arms lost a considerable amount of blood plus sikua nimekula kitu kijana nikashikwa na kizungu zungu na ka light head ache , anyways NI life, nikaruka hapo chemist ,kwa pocket nikona 120 fare exact ya kunirudisha mtaa ikabidi nibuy Bandages hapo and painkillers, 100bob ikazama. Nikishuka complex nirudi offe Ile kamaji ya kumeza dawa ilikua ishaskuma my bladder, nayoo choche nisake base ya kunyora ,

Kijana light headed,sijui nilipiga chuom ngapi before kusettle for the next corner little did I know,chuom NI guarded, like a friend of mine likes to say "" karibu na mzuri"" , hio yako si mbogi , vijana Ka Saba pale, capes NI different colours, donning style NI the same,tip quarter Inches away kufunika brows, (and I swear I did see a familiar face) ,taxin ishawafikisha Maldives kila msee na there bottled water, khat stock at hand na a single half a litre  best gin hapo Kati Kati Yao next to a 'one love' jamming Bluetooth speaker. This isn't usually the best time to back down, ""karibu na .....


""Kuja karibia , let's dooh"", they simultaneously yelped in my moment of hesitation, turns out it was a fave spot for lavatory seekers, on quick thought I told them ' Niko pale offe ya mama Mikey mnatokea hio maneno ya USAID, they sighed in agreement and whispered assurances amongst themselves, pointed me to a trashed piled corner as I gave afew of the  interested fist bumps, did my deed and was out of that corner asap.

Once  out of the back street I realised I didn't come out the same street I came in, but risking retracing my steps back through the same backstreet? Nop!, I'd  take my chances with this Main street that more or less gave  a bigger backstreet vibe , sijui Ka ushai jipata mtaa na hizo mtumba thrift zako za soo soo Unakaa sonkole, ghai! karibu na!

My stubborness and light headedness guided me push further down the street, then a voice yelps "" NI sawa ngapi hapo?"" A thin voice pierced the street.
Only then do I realise bandaging my forearms forced me to roll up my bloodied sleeves exposing my dawn smart watch, 'hii imeenda' , that was my thought , then a deeper one  says 'ebu nilipe' only then do I turn to a 6foot plus  thick dude with an equally thick bushed body evident from his low hanging vest  and pair of low sitting khaki shorts , the other equally tall all covered up in orange dungarees , but bare atleast from his scared chin, both had seemingly meancing grins , ushai perembwa lakini unajua hauna kakitu 😂 


I had already made peace with my fate , I tell the guys "" naeza waachia hii gesturing to my watch but peculiarly this niggs weren't interested in my cheap ass watch and walked away the Lebron built one saying something like 'utatulipa' , I quickly reverted to my miss adventure now clearly nikijua I was lost in the efin ghetto, lakini mungu NI Nani the fear of being bulldozed in an unfamiliar environment guided me to a path I was familiar with, I was in shauri Moyo, how I got that far I don't know, that angel that told me to leave my phone at mama Mikey's office ,heaven sent.

Now since I was in familiar environs I decided to take a route that goes through gikomba thrift market wale wanajua hapo rive soko ya viatu, I crossed into the market and window shopped confidently na my 20bob kwa mfuko, but then again as I combed through the crowd I see two familiar faces the two tall dudes right behind me even looking like we are shopping together they give me the same grin ,with my naivenes at the time I dismissed them as friendlies and even start cracking jokes about ladies oversized knickers as we walk together now.


Natembea Tu alafu naanza kuskia nikama nimeanza kutumia energy mob kushinda vile nilikua natumia then I throw my hand into my pockets and I find a phone ,Samsung dual something taped from the mouth piece through the screen to the ear piece and again to the back cover . I ask the dudes ,' hii NI yenu' they quickly yelp 'zii ,si yako' then now reality slaps me the face and I quickly take back steps towards the direction I was going and yank the phone as hard I could back on the road at which one of them (skiny dungaree one) picks up the phone and walks away hastely the other shouts at me 'utatulipa' and he takes off running the other direction, then I go into my other pocket and there's another phone a Nokia mtulutulu now this one taped and rubber held,  these niggs were setting me up for a mob or even get shot. Same thing , I throw the phone out on the road towards their direction,then as I walk away past a mtumba vendor he whispers "" kijana umeokoka wezi sugu "" 
 
Karibu na mzuri!",Kenya,JokeyDogg0555,2025-02-07 04:55:18,https://www.reddit.com/r/Kenya/comments/1ijn7sn/karibu_na_mzuri_a_day_in_the_life_of_a_job_seeker/,5,6,usaid kenya
Does USAID's exit mean it's a free reign for the Bill Gates Foundation to step in and dictate Kenya's health system? Ion Beggars can't be choosers and don't look a gift horse in the mouth.,,Kenya,yourakim,2025-02-06 13:53:51,https://i.redd.it/cflzzr7hxihe1.jpeg,0,6,usaid kenya
"""USAID was helping pay nurses' salaries.""",I have seen this claim being thrown around casually without any concrete referencing. Is there any official financial audit report breaking down USAID projects and how they used its funds in Kenya? ,Kenya,krisdyabe,2025-02-05 11:32:21,https://www.reddit.com/r/Kenya/comments/1ii7ywd/usaid_was_helping_pay_nurses_salaries/,2,15,usaid kenya
USAID Repercussions + Economy,"My neighbour’s wife was a very big shot in USAID and has now lost her job. Children have been removed from big private school. Husband is a big guy at PWC. Lifestyle changes are occurring rapidly as her income has vanished. Thousands of her USAID coworkers were sent home with no salaries. 

USAID Vendors, contractors, non-profits that received funding from them have all been left in a lurch. Sasa machozi zimeanza. 

Next is empty apartments around “high class” areas.

UN is laying people off left right and center.

Additionally, public assistance programs in the Europe and America are being slashed so remittances by a certain sector are falling.

If you think things are hard, ngojeni mpaka December. A lot of your highlife hotspots are about to close. A lot of these restaurants are about to close. 

Crime shall return so please rudini mashambani mulime.

Avoid Mombasa, Lamu and malls.


",Kenya,uasingishu408,2025-05-14 15:11:02,https://www.reddit.com/r/Kenya/comments/1kmhn87/usaid_repercussions_economy/,12,33,usaid funding
Economy,"For the experts in matters economy and finance I ask this politely(mnielezee Kama mtoto tafadhali). How is our country still semi functional? Everyday we hear cases of billions lost here billions lost there. Sometime there was reports of I think 1.3 trillion irregularly withdrawn from the treasury, the dollar has surprisingly been stable at around 129 despite all this and there was the case where funding would be halted by the USAID. How has the economy not crashed yet? Is it normal to lose a third of the budget and still have a running country?",Kenya,Confident-Benefit240,2025-04-06 17:01:41,https://www.reddit.com/r/Kenya/comments/1jsytyp/economy/,1,15,usaid funding
Is kenya capable of funding its needs now that USAID has been disbanded?,How is kenya prepared to fill the vacuum of USAID assistance? ,Kenya,westmaxia,2025-03-08 08:08:58,https://www.reddit.com/r/Kenya/comments/1j6cjze/is_kenya_capable_of_funding_its_needs_now_that/,1,6,usaid funding
USAID HIV FUND CUTS,"Guys with the recent halting of funds for HIV, what's the situation on the ground 

Are patients still getting their medication on time?

As well do you think this William ruto govt is doing something to fix this or to plug the deficit?

Or it's everyone for himself God for us all",Kenya,Pure_Ad_6130,2025-02-28 15:43:13,https://www.reddit.com/r/Kenya/comments/1j0am0k/usaid_hiv_fund_cuts/,4,6,usaid funding
"Finally, it's gets deeper. I lost my job","With the recent USAID cuts, I knew we  might get here but didn't know how fast it would be. 

A little background, I have worked in NGOs for a few years now and I've realized once you start in one NGO you can easily hop to another one as long as you understand what you need to say during interviews and how to do your work.

 I recently started a consultancy with one of these big NGOs that deal with refugees. My first contract was ending on 31st Jan and I got an email today (basically due to lack of funding I've been let go). 

I know most of these NGOs dealing with refugees rely on BHA funding which comes from USAID and with that gone, most people have and will loose their jobs. DRC, Impact Initiatives,WHO, IOM are among the organisations that I know have started letting go of their employees. These are just unfortunate and very uncertain times.

Anyway, my thoughts are all over but it's funny how I'm not even stressed because I have no control over the situation. Currently seated with my mum and I've not told her the news yet. Planning to keep it to myself for sometime. 


For those who have lost their jobs due to the USAID cuts how are you navigating? ",Kenya,Past_Concentrate_148,2025-02-12 18:39:13,https://www.reddit.com/r/Kenya/comments/1iny5w8/finally_its_gets_deeper_i_lost_my_job/,185,75,usaid funding
USAID woes,"many people don't know how USAID made many Kenyans rich and enabled some to manage a better life(financially and health-wise) lakini saii it's visible 

Almost 500k Kenyans(households) are set to lose their source of livelihood, diseases are about to spike in Africa which could've been prevented via vaccination which was funded by USAID lakini Trump ni nani

Although I don't advocate dependency as a country this one will however have a serious effect on Kenya and Africa as a whole considering corruption crisis as whole

Lakini someone said if our president can renovate the state house with billions then he also has the ability to fund the most important program ""Children Vaccination Program"" sio tu kuleta mapastor wazungu huku. 

either way the effects itaonekana before hii mwaka iishe

but real talk, Has there ever been a good US president?... who's just human for human?",Kenya,_KingCleo,2025-02-07 16:10:26,https://www.reddit.com/r/Kenya/comments/1ijyka5/usaid_woes/,3,9,usaid funding
USAID wasn't worth it.,"It has come to light that USAID had been funding private institutions for obvious reasons. As much as  USAID played a part in making societies better, seems like there were more sinister scenes behind the curtains. ",Kenya,Maximum-Boss-4214,2025-02-07 08:34:10,https://i.redd.it/cxv28znrhohe1.jpeg,92,198,usaid funding
