title,selftext,subreddit,author,created_utc,url,score,num_comments,keyword
"Why Americans might go to Heaven, and Kenyans won’t","Religion is an example of weak people becoming resentful because of their inability to be strong. Religion is important to people who are oppressed and Nietzsche calls it slave morality. It is not that the oppressed people cannot be the oppressors, they just don’t have access to being oppressors. Look at Kenya, for instance, a religious country with a majority waiting on God to save them. Yes, go out and ask them, you will find them fasting and praying for a good country. The oppressed create a slave morality, which resents the rich. Religion urges you to be humble, meek, among other things, and then perceives them as good. It embraces suffering for a greater good. So, churches will never ask people to fight for their rights, but will convince them that their suffering is good and a test towards something great.

And that is why I think Americans will go to heaven (heaven meaning a good life and not the divine one) and we won’t. Because we are weak and we live a lie. The Americans and other developed countries are like that because they understand their rights and are strong enough to fight for them. How long would it take to realize that God is never coming to save you? How long till you get out of your comfort zone, and realize that the good life you want is actually within your jurisdiction? How long till you realize that you are the duty bearer of the accountability you speak of?

Edit: Since I can't change the heading, heaven in this case is purely figurative, not literal. Heaven is good life not the divine.",Kenya,petedarkpete,2025-01-24 06:32:13,https://www.reddit.com/r/Kenya/comments/1i8pb3o/why_americans_might_go_to_heaven_and_kenyans_wont/,0,79,development aid kenya
Kenya isn't ready for the type of politics and leadership some of us wish we had.,"Recently I've developed an overall dark view of the Kenyan public based on trends and discussions online regarding 2027.

We can't seriously pretend to want a better country if a significant number of Kenyans still follow Ruto, Rigathi, Raila and many other shady characters who are essentially the source of our problems.

Our political establishment lacks serious talent capable of bringing change too. In short, Kenya lacks a visionary and transformational leader. I'm not sure such an individual even exists, and who has the resources and courage to vie.

There's even debate about fronting the even more corrupt and hateful Matiangi to take over from Ruto in 2027. You seriously can't want to get rid of Ruto just to replace him with  Matiangi. That would officially confirm that we're a moronic society incapable of basic critical thinking.


All factors considered, I've come to the conclusion that Kenya is a desperate and hopeless society with a vastly uninformed population prone to herd mentality and identity politics. As emotional voters, Kenyans are easily swayed by cheap propaganda into falling for any shady characters with charismatic appeal who makes grandiose short term promises. Kenyans distrust alternative leadership and view all candidates as bad, and vote on basis of choosing a ""lesser evil"". 

I'd love it if Kenyans proved me wrong in 2027",Kenya,Admirable-Resolve619,2025-01-22 16:54:42,https://www.reddit.com/r/Kenya/comments/1i7fq1a/kenya_isnt_ready_for_the_type_of_politics_and/,20,12,development aid kenya
Advice for woman considering security guard jobs in Canada -- scams?,"I'm an American currently staying at a conservancy in Kenya, and one of the rangers has been asking me for advice about her plan to move to Ontario Canada to take a job as a security guard.  This immediately raised questions in my mind because I know the Canadian immigration system requires employers to prove that there is no citizen who will take the job before allowing hiring of foreigners.  I also have read articles about scammers in developing countries including Kenya scamming and cheating job applicants.  On the other hand, I did find one online article that said that there is a need for security guards in Ontario.  I asked if she has talked to people currently in Canada who have done this job and it doesn't sound like she has, which concerns me. 

Does anyone have advice I can share with her?  Specifically, (1) how to ensure that the recruiter is legitimate (2) any contacts of Kenyans currently doing this sort of work in Canada who may be able to advise her (3) Any other advice I can give her?  ",Kenya,Simple_Breadfruit396,2025-01-22 03:17:58,https://www.reddit.com/r/Kenya/comments/1i71kd3/advice_for_woman_considering_security_guard_jobs/,3,0,development aid kenya
WE'RE HAPPY OUR APP JUST SUPASSED 100 DOWNLOADS.,"We launched [**SOKI**](https://play.google.com/store/apps/details?id=com.soki.app) end of last year and recently hit our first milestone and are so excited about it. We crossed the 100 downloads mark. We announced the app in the Gen Z whatsapp channel and saw a spike in downloads and usage of the app. We hope to reach our next milestone of 1k downloads by end of Q1 and 5k by end of Q2.

SOKI is a platform that amplifies your social experience. We help business venues become more social and engaging both between customers and with the business owners thus Helping businesses understand their customer needs and improve their services. If you would like to know more about what we're about check our site [soki.co.ke](http://soki.co.ke). We will be launching soon across universities in Kenya.Restaurants, Events and residential areas in Nairobi.

Also if you have an iOS device it would help us out.We cant launch on iphone because we dont have a developer account and we need the Developer App on iOS to register.

Stay tuned SOKI is coming to a neighborhood,event or venue near you soon.

Thank you!

https://preview.redd.it/f0pkzl4hvaee1.png?width=750&format=png&auto=webp&s=2df302385304af11c629b1fd49b8a97f122ef7e6",Kenya,Clear-Meat-6311,2025-01-21 08:00:09,https://www.reddit.com/r/Kenya/comments/1i6dqvm/were_happy_our_app_just_supassed_100_downloads/,28,10,development aid kenya
African Self-esteem,"I didn't know how to term this but...

Is it only me that whenever I am searching for anything intellectually incluned that relates to me as a Kenyan, be it a research topic and papers, philosophy, religion, history, a medical condition or symptoms and it's medication, social topics like marriage and relationshis, reviews on a wide array of products i.e tech products, cosmetics, medicine, travel destinations, food and nutrition, I always find myself searching first from African professionals, researchers, revieweres, travel vloggers and bloggers, journalists etc. before venturing out to see what the West thinks?

And this comes second to nature subconsciously. I asked around from friends and they honestly don't care much and it got me thinking if I am alone.

There is so much disinformation out there about so many issues affecting and surrounding the African being down to our anatomy that I think always using western blanket impositions is dangerous especially in attaining the African Pan-Africanism we all aspire to. Just imagine Kenya and Africa outside the lenses of Neocolonialism. A pipe dream maybe but surely not far fetched if we intentionally choose to be fully self reliant and sufficient by continuing to champion and funding Research cognitive to Africans, encourage literature and arts by documenting our unique lives, redefining oir history and championing it for a better future for ourselves and weaning ourselves off the culture of outside reliance.",Kenya,Either_Letterhead_39,2025-06-17 08:46:53,https://www.reddit.com/r/Kenya/comments/1ldi2ul/african_selfesteem/,6,4,kenya donor funding
Incubators- The Infamous Startup Support Racket,"Anyone else notice there’s a whole swarm of these *“training-first, funding-maybe”* programs targeting African startups? Especially here in Kenya?

Every other year, there’s some new incubator or accelerator dropping flashy ads promising mentorship, exposure, networking, “access to capital”... the usual dream.

But then you visit their website — and the first thing you see is a price tag.

>KES 15,000 to attend our Founders Bootcamp

Bro? Excuse me?? You want founders — the people already broke, already hustling, already building — to *pay you* to teach them how to be founders?

Make it make sense.  
They’re literally selling *the idea* of being a founder back to the people who are already doing it. 😭

It’s like walking into a hospital with a bleeding arm and they say, *“Sure, but first, pay for this course on how to be a better patient.”*

These programs are out here monetizing the grind.  
Not funding founders — they're farming us.

If your “incubator” makes its money by charging struggling entrepreneurs for workshops, training, and a shot at “maybe funding”… you’re a scam.",Kenya,bravethoughts,2025-06-09 12:12:04,https://www.reddit.com/r/Kenya/comments/1l7367k/incubators_the_infamous_startup_support_racket/,2,2,kenya donor funding
I don't know how to title this ...,"I don't know if I've tittle this correctly but ...., I'll just write sometimes all you have is pen and paper and in my case a laptop ,Wi-Fi and reddit will do , lol.

I'm in my mid thirties for context. 2 years ago I embarked on a journey to create employment not only for myself but possibly for the people around me in my community and globally. A girl can dream right. My thought process was we consume a lot from the western world and all other areas of the globe but what do they consume from us directly? They have platforms and avenues where they can sell arts crafts and all kinds of creations straight from their backyards or garages and make really good money and sustain their livelihoods'. I was like you know what, we have all these hand crafted stuff that they pay top dollars for why cant we create platforms or channels  where our local artisans especially east Africans can market and sell their artifacts to the world and make their money ? 

I also had an idea to build a digital product one that defies borders, wipes them out completely and turns the world into a true global village, put real connections right at our fingertips. Just Imagine the infinite doors this could open mixing cultures blending Ideas people from totally different worlds working together with the possibility of creating honest income. A girl can dream. besides mobile money transfer originated from Africa, Kenya to be precise.

One thing about it that's not two, dreams need actions to actualize, to actualize one needs resources.  Resources can be monetary but in my journey I've come to realize resource is a heavy packed word. A roof over your head , a meal , health care , moral mental ,emotional support all are vital resources when it comes to building on as well as actualizing our dreams. For the past one year I've been running on fumes. last week Monday had to give up all my possessions for auction, the last thing I have to my name is my laptop. by end of day today I will be homeless as my landlady gave me notice to vacate .

I tried setting up a go fund me ... funny story the hoops and loops one has to go through smh. 

I tried UFANDAO guess what they expect you to give first to receive and you know what you cant donate to African causes literally. when you try you find you're blocked from donating to any African causes 

And then there's PayPal that treats receiving money in Africa like a conduit to funding terror groups or money laundering. Try creating [Paypal.me](http://Paypal.me) let me know how it goes if you're in Africa.

There's a chihuahua somewhere on these fundraiser platforms that's probably garnered over 10 thousand USD in donations while I have to pay for my fundraiser to go live ... diabolical. I don't have it but I somehow have to have it to get help I need to have it ? I'm confused lol. 

My mental health is probably in the dumpster somewhere, but lets assume that for now, if I ignore it long enough it probably wont exist.  

What am I saying ? dear Africa we have the capacity resources brains skilled labor  and everything else in-between to create a self sufficient continent. we let the western world take soo much from us while they give literally nothing back but religion and a dream that our riches are in heaven while actively enjoying our tangible resources to make their lives easier and better. 

Wake up Africa , for how long will you be complicit in  your own erasure ?  ",Kenya,ComfortableStop4431,2025-06-07 05:30:38,https://www.reddit.com/r/Kenya/comments/1l5dc2r/i_dont_know_how_to_title_this/,5,2,kenya donor funding
Receiving money in Kenya,Hi guys. First post here. I’m a Ghanaian try to send my friend some money. Things are tight and I’m just trying to help. I’ve been to Kenya twice but I’m currently not in the country. Anyone with an idea on how I can send funds from my account to his account or MPESA. Thanks,Kenya,Dapper_Price7069,2025-05-31 14:14:14,https://www.reddit.com/r/Kenya/comments/1kzy2x0/receiving_money_in_kenya/,10,34,kenya donor funding
Dear Gentle Readers,"Good morning my gentle readers

Today I have a question to this men, why are you so tied up with your friends that you prioritise them over your families ama it's just baba without manners? 

Anyway Reason number 4 on why I will never forgive baba without manners: his unhealthy attachment with his boys. 

This particular friends have been a thorn in my life and I just blame baba without manners (I will save his number like this😂😂). 
Anyway let me take you back to the end of my second trimester heading to the third, that's when we moved in together.  

How do you people house hunt when searching for a house that utaishi na spouse wako? Si mnaenda pamoja ama? And weigh the options right? 

Aaah, baba with funds went with his friends looking for a house that we are supposed to live in. I tell him, na si uende na mimi juu unaenda kuishi na mimi😐😐. It fell on deaf ears. Anyway, he goes with them looking through different houses and the only thing I get is videos and reasons why he doesn't wanna live in the area. 

He finds the house we are currently living in, and kwanza it is on the 5th floor and this building has no lift. By then I was very heavily pregnant and such a distance would have been a great inconvenience. Anyway, baba without manners commits all of that and just sends the video. I see it's a nice house and tells me, ameshalipia. 

By then, I had moved out of my sweet house🤣🤣the house i was very happy in and experienced so much growth. Aaah, baba without manners wewe🙄🙄🙄. So, he moves everything in and comes for my clothes. And tells me, he will come pick me up kesho yake. True to his word, he did come lakini hio heaviness kwa roho yangu jamani. And shockingly, nilipanda stairs mpaka fifth floor and I was out of my breath. 

But moving into that house became a thorn into my life, each weekend baba without manners forces me to go home because he wants to host his friends. At first I get mad, and walk out naenda home. One weekend I refused to go home, I told him, kwani nyi wanaume wote wasita hamuezi kakomboa air bnb mkae huko🙄🙄

Gentle readers, ni kama niliguza nyuki, he started ranting, he said venye, I do Everything for you, na we kunipea tu privacy kwa nyumba yangu ata huezi. Enda kwenu nitakukujia tuende kanisa on sunday🫥. Mimi nikasema siendi, Aaah, aliongea matope wadau hata skuamini. He left, akaenda shugli zake and came back the following day mchana claiming ametoka ulevi hata sikuuliza. 

I asked him one day, si hata unipeleke just kwa park nikaone wanyama basi. ( nikiwa mdogo sijai enda hizo school trips because apparently my shosho didn't see the need to pay for me to go see wild animals). He told me he will ask his friends they plan for it. Aaah, curse those men, walikataa wakasema huko wameenda mara mingi. Anyway, the only place baba with manners takes mi ni kanisa na kwao na kwetu sometimes. Smh. 

Nothing can be done juu lazima hio committee iamue mambo ya kwangu. Anyway, one of his friends has a wife that decided she wants to be happy. Now, they all call her a hoe just because hangojei bwana yake to do things with her. Baba without manners is now projecting that on me. He says venye akiwai nipata nikikunywa tutakosana vibaya sana. 😂😂😂. 

Now, that is really affecting my freedom, juu, lets say I go even to town, aaah baba without manners will keep calling me after every 20 minutes aniambie niende home. Kwanza saa hii with our baby is worse. He will tell me, rudi home uangalie mtoto as if I do not know that. 

Let's go to today's incident. Nimemwambia I will leave for an hour or two, my mum is coming to town na anahitaji my help. Eeei gentle readers, ashaanza kuniuliza for how long nakaa huko. I told him mimi sijui, si he left akaenda. Now as we speak, alishapiga simu kuniambia venye whatever i am going to do in town sio important at all. I should be very fast and go back home juu hio sio emergency. 

For  context, my mum kuna siku amehitaji blood donors and baba without manners did not he gave a flimsy excuse. I couldn't donate because I am breastfeeding and pia I gave birth through CS so singekubalishwa. My mum alikua admitted close to 3 weeks and hakuai bother kuenda hata kumuona and she asked for him. He said atamuonea nyumbani, two months later he has never even asked kama ako sawa. 
Aaah, baba without manners ananichukia mimi na familia yangu yote🤣🤣🤣. 
Kwanza now that i am dependent on him, he is enjoying every bit of my misery. Hata akinituma supper, of which money is calculated so he will inspect kama nimenunua what he says, he will keep calling me to make sure I am back kwa nyumba by 6pm. Claiming hataki giza inipate nje, but surely, ulinipata nikiishi pekee yangu😅😅😅 hio supper ata saa tatu ya usiku nlikua naendea. 

So men, what the hell do you rely on yiur mbogis for? 

Till later gentle readers, 
Have a fantastic day as you grind. ",Kenya,Electrical-Bother-62,2025-05-30 06:36:51,https://www.reddit.com/r/Kenya/comments/1kyxebr/dear_gentle_readers/,59,74,kenya donor funding
Missgivings of AfriCOG and Okoa Uchumi's(TISA) in their latest report - Stealing the Future,"Link to doc -> https://africog.org/wp-content/uploads/2025/05/Stealing-the-Future.pdf

**1st** missgiving are pleadings and/or pandering to defunct/institutions seeking relevance, since ~1973, referred to as Bretton Woods. No country has ever come out of their ""Structural Adjustment Programs(SAPs)"" stronger economically, socially or politically.

**2nd** is a great ignorance of how modern monetary system works. Kenya needs NOT borrow in foreign currencies as she has her own called the Kenyan Shilling(KES). These borrowing expose serious structural problems in the jurisdiction called Kenya.

**3rd** is an austerity bias for fiscal policy which is an echo of Bretton Woods advice. KE gov't, entity with 22-23% of GDP, has recently cut her spending by ~2% of GDP or KES ~400 Billion. Results have been growth figures of 4.6% & 4.0% respectively for 2024 fiscal quarters Q1(July - Sept 2024) & Q2(Oct - Dec 2024). KNBS has refused with Q3 data i.e Jan - April 2025. Does any Kenyan want a continuation of this? Macro-Economics 1st/**golden rule** is that one sector's spending is another's income. Cut spending, cut incomes, cut output and finally employment.

**4th** is a complete ignorance or denial of Balance of Payments(BoP). It's NOT just here but also in recent talks, a running theme?, hosted by University of Nairobi where there's little mention of this - https://www.youtube.com/watch?v=b3tifBvwAfo . Report launched in the livestream - https://documents.worldbank.org/en/publication/documents-reports/documentdetail/099052625075532839 . Fiscal sustainability ""problems"" as we've established are frankly **nonesense** as KE has & is the monopoly of her own currency. It can never run out of it! It's ONLY KE gov't that can *print*/issue this currency! Just try and counter-feit KES & you'll see magnitude of charges racked against you! At ratios  of ~200+% for external(foreign currency) public & publicly guaranteed(**PPG**) debts to exports this isn't sustainable! Source for this is KE Treasury's Draft MTDS(Medium Term Debt Strategy) for 2025 page 20 - https://www.treasury.go.ke/medium-term-debt-management-strategy/. Capital accounts supposed to counter the current account(trade deficits) are very weak.

**4.1** Certian items, food/core staples, in current account(part of Balance of Payment's) are specifically worrying. Imports are definitely a plus as they build onto what KE produces(*KE's pile of stuff*) however on key/strategic issues it's NOT feasible. Food/core staples represent ~17% of total imports & are valued at USD ~5 Billion or approx ~8 months of fuel/energy related imports. These are **National Security** items which is shocking the ideology/philosophy being adopted that of *food security*(you can buy your food) Vs **food sovereignity**(you must produce your own food). I discuss this in a recent comment & the frauds/damned lies Vs reality - https://www.reddit.com/r/Kenya/comments/1kmg8ye/we_never_learn/mslfbsk/

**4.2** I'd dare say the syndicated borrowings, Eurobonds & so termed budgetary support by IMF are directed to these 2 huge items that take ~30% of all imports i.e food and fuel.

**5th** is about flows of corruption/theft popularly given a figure of KES ~2 Billion daily. Well these monies are entering/remaining & swimming around in KE's financial/monetary system. ""Borrowings"" in local currency are the same as taxes & other **impositions**. They are **ex-post** i.e happen after the fact. With ~800 Billion in pending bills and weak capital accounts(no.4 above) there's NO other source that can explain the bid-cover ratios seen for issues and re-openings of short(t-bills) & long tenure(Infrastructure bonds etc) gov't securities.

**5.1** More supporting evidence of the above stolen/pilfered funds swimming around in the same pond. [Commercial] Banks have seen huge & consistent growths of their **liability** side i.e customer's **deposits** to the tune of 6.7 Trillion or 19.3% of GDP in 2024 from 5.2 Trillion in 2023 and 4.1 Trillion in 2022. These mandated sources of capital(deposits), by CBK, are both NOT costless & risk free(bank runs) hence banks must invest/park them in risk free & stable vehicles to offset their risks & operational costs. This is the popular trope that *""banks thirst for gov't debt""* or *""banks are lending to gov't and not private sector""*. But where are these deposits coming from given the two sources above being insufficient or curbed? No money gets lost in a system!

**5.2** There's nothing like a crowding out of private sector in a country running deficits of ~6-7% of GDP. These are **risk-free** & **stable** assets to **private sector**! What is evidenced here is a **distributional problem**(in soft language) or if like outright theft!. A continuation of the 1970's and 1980's second crisis of Economic theory between the two Cambridges.

**6th** Is a dismisal/lack of appreciation NOT only voiced in this document but by many prominent Kenyans. It's statements that KE gov't MUST get the hell out of the way. This includes basic and/or **natural monopoly** items such as energy, critical infrastructures for communication & transport etc. The characterization is that gov'ts do NOT produce and/or stimulate anything. That ""markets"" always ""stabilize""/get things back into **""equilibrium""** by themselves. I do NOT know if this comes from KE churning out only output & expenditure-based statistics of **National Accounts**. For the latter gov't or institutional sectors data is NOT yet compiled - 2. Methodology from https://dsbb.imf.org/e-gdds/dqaf-base/country/KEN/category/NAG00. **FYI** You can calculate GDP via 3 approaches - **Income**(sources of funds), **Expenditure**(uses of funds) & **Output**(production of goods/services). To dispell myths that gov'ts are nothing but leaches there is Mariana Mazzucato's book - **The Entreprenurial State**.

**7th** Last but not least is classic identification/pointing out of a problem without any solutions by **AfriCOG & TISA**. Exchequer releases/**gazettements** that happen ~1-1.5 months are NOT adequate. They must be more frequent(daily statements like US's Daily Treasury Statement aka The **DTS**) and more granular(dis-aggregation/lower levels below **vote heads** showing things like receipts, invoices etc). There's a system in the works if you listen to **KE Treasury** & associated folk however recent history does NOT bode well. I'm talking of the stalled/failed **digital land registry system** dubbed **""Ardhisasa""** that has largely ground to a halt after it's pilot phase. Can we expect anything of the pending/yet to be implemented **Treasury Single Account**(TSA) system by KE gov't? ",Kenya,AdrianTeri,2025-05-30 06:25:36,https://www.reddit.com/r/Kenya/comments/1kyx837/missgivings_of_africog_and_okoa_uchumistisa_in/,1,1,kenya donor funding
The Star today,Eh! ,Kenya,ForsakenTumbleweed40,2025-05-27 08:49:21,https://i.redd.it/j5ws7z3sfa3f1.jpeg,6,5,kenya donor funding
