title,selftext,subreddit,author,created_utc,url,score,num_comments,keyword
Karibu na mzuri! A day in the life of a job seeker.,"Sijui  niite bahati ama kuponea chupu chupu. Nimeitiwa hustle flani nikiwa hapo CBD , nayo mimi afisa mtiifu wa Generali Shillingi ya Kenya nikareport post . post ilikua hapo kamukunji.  I was given a days contract as clerk wa kudistribute  ""jst arrived"" USAID relief food , in my mind I was like this is God , I arrived in town that morning for an interview ya izi mboka za gulf .Anyways kijana nimepiga m&s zangu  za pale T2 safi , navy blue pants n a white shirt, chini  nimefunga hesabu na dark brown boots , Clarks flani I scored gikomba na bei ya Sunday (btw Sunday bei NI ya -wananchi-) .

Alright post pleasantries tume exchange na mama Mikey, ( shes the one who called me in )  nikaonyeshwa desk na mine forms pale tayari , lakini si mnajua Tu mambo ya hii serikali msongo, relief food kwa TV walishapiga picha za exchange handshake, lakini kwa ground Lori ya mikate ndo imefika pekee sasa NI tutegee Lori ya unga na mafuta iko hapo' Uhuru highway'.  

20mins wait ishageuka 3 hrs , ata wenye walikua wamekujia hio aid ikabidi warudi home na hustle kidogo afu wakam mabadae, Mimi nilitoka kwetu malaa 5:30 morning ndo nimake interview ya 8:00 anniversary towers, so pale kwa desk ya mine nishaanza kudrool , si fault yangu men, Kiti ilikua billionaire barn mesh , very comfortable thing ,miguu pale juu ya acquisition form za wenyewe,nikua Nishaanza kuota vile sasa hao clients na investors WA Kai and Karo wamehamia sasa kwa kampuni ya mine long story short niliamshwa na sauti ya glass wall ikimwagika, lakini vile hio sauti ilikua karibu I dared not open my eyes Mimi NI mgonjwa wa macho am keen to protect my eyes more than am eager to see whats happening.

I could feel pieces of glass trickle down my body as if I did sweat silica ,turns out Mike my bosses son was skating around his mom's empty office before he went through the glass wall, I was left  with scratches but two deep cuts on both of my fore arms lost a considerable amount of blood plus sikua nimekula kitu kijana nikashikwa na kizungu zungu na ka light head ache , anyways NI life, nikaruka hapo chemist ,kwa pocket nikona 120 fare exact ya kunirudisha mtaa ikabidi nibuy Bandages hapo and painkillers, 100bob ikazama. Nikishuka complex nirudi offe Ile kamaji ya kumeza dawa ilikua ishaskuma my bladder, nayoo choche nisake base ya kunyora ,

Kijana light headed,sijui nilipiga chuom ngapi before kusettle for the next corner little did I know,chuom NI guarded, like a friend of mine likes to say "" karibu na mzuri"" , hio yako si mbogi , vijana Ka Saba pale, capes NI different colours, donning style NI the same,tip quarter Inches away kufunika brows, (and I swear I did see a familiar face) ,taxin ishawafikisha Maldives kila msee na there bottled water, khat stock at hand na a single half a litre  best gin hapo Kati Kati Yao next to a 'one love' jamming Bluetooth speaker. This isn't usually the best time to back down, ""karibu na .....


""Kuja karibia , let's dooh"", they simultaneously yelped in my moment of hesitation, turns out it was a fave spot for lavatory seekers, on quick thought I told them ' Niko pale offe ya mama Mikey mnatokea hio maneno ya USAID, they sighed in agreement and whispered assurances amongst themselves, pointed me to a trashed piled corner as I gave afew of the  interested fist bumps, did my deed and was out of that corner asap.

Once  out of the back street I realised I didn't come out the same street I came in, but risking retracing my steps back through the same backstreet? Nop!, I'd  take my chances with this Main street that more or less gave  a bigger backstreet vibe , sijui Ka ushai jipata mtaa na hizo mtumba thrift zako za soo soo Unakaa sonkole, ghai! karibu na!

My stubborness and light headedness guided me push further down the street, then a voice yelps "" NI sawa ngapi hapo?"" A thin voice pierced the street.
Only then do I realise bandaging my forearms forced me to roll up my bloodied sleeves exposing my dawn smart watch, 'hii imeenda' , that was my thought , then a deeper one  says 'ebu nilipe' only then do I turn to a 6foot plus  thick dude with an equally thick bushed body evident from his low hanging vest  and pair of low sitting khaki shorts , the other equally tall all covered up in orange dungarees , but bare atleast from his scared chin, both had seemingly meancing grins , ushai perembwa lakini unajua hauna kakitu 😂 


I had already made peace with my fate , I tell the guys "" naeza waachia hii gesturing to my watch but peculiarly this niggs weren't interested in my cheap ass watch and walked away the Lebron built one saying something like 'utatulipa' , I quickly reverted to my miss adventure now clearly nikijua I was lost in the efin ghetto, lakini mungu NI Nani the fear of being bulldozed in an unfamiliar environment guided me to a path I was familiar with, I was in shauri Moyo, how I got that far I don't know, that angel that told me to leave my phone at mama Mikey's office ,heaven sent.

Now since I was in familiar environs I decided to take a route that goes through gikomba thrift market wale wanajua hapo rive soko ya viatu, I crossed into the market and window shopped confidently na my 20bob kwa mfuko, but then again as I combed through the crowd I see two familiar faces the two tall dudes right behind me even looking like we are shopping together they give me the same grin ,with my naivenes at the time I dismissed them as friendlies and even start cracking jokes about ladies oversized knickers as we walk together now.


Natembea Tu alafu naanza kuskia nikama nimeanza kutumia energy mob kushinda vile nilikua natumia then I throw my hand into my pockets and I find a phone ,Samsung dual something taped from the mouth piece through the screen to the ear piece and again to the back cover . I ask the dudes ,' hii NI yenu' they quickly yelp 'zii ,si yako' then now reality slaps me the face and I quickly take back steps towards the direction I was going and yank the phone as hard I could back on the road at which one of them (skiny dungaree one) picks up the phone and walks away hastely the other shouts at me 'utatulipa' and he takes off running the other direction, then I go into my other pocket and there's another phone a Nokia mtulutulu now this one taped and rubber held,  these niggs were setting me up for a mob or even get shot. Same thing , I throw the phone out on the road towards their direction,then as I walk away past a mtumba vendor he whispers "" kijana umeokoka wezi sugu "" 
 
Karibu na mzuri!",Kenya,JokeyDogg0555,2025-02-07 04:55:18,https://www.reddit.com/r/Kenya/comments/1ijn7sn/karibu_na_mzuri_a_day_in_the_life_of_a_job_seeker/,4,6,usaid kenya funding cut
Does USAID's exit mean it's a free reign for the Bill Gates Foundation to step in and dictate Kenya's health system? Ion Beggars can't be choosers and don't look a gift horse in the mouth.,,Kenya,yourakim,2025-02-06 13:53:51,https://i.redd.it/cflzzr7hxihe1.jpeg,0,6,usaid kenya funding cut
Advice for every kenyan who works for an NGO (Non governmental organization),"I hate to be the bearer of bad news but the recent move by President Trump to cut donor funding will affect your payslip and i am sure of it. Most NGO's are funded through donor support. Your bosses may not tell you, but in the next 2-3 months, most of you will have to be let go (fired). You need to start making deliberate decisions to prepare for that eventuality. I know you are used to good salaries (200k - 500k) and you probably live in an apartment of 60k-120k. First things first..

1) Look for a cheaper rental house (20k max) that you can afford to pay without struggling.

2) Avoid taking any loans (cars, mortgage) cos this will exacerbate your situation incase you are fired

3) Start thinking of a business you can setup (be smart about it, businesses that target basic needs like food, clothing, shelter tend to do good)

4) Start praying that Trump will change his mind and that the donor support will not be halted.",Kenya,wangai254,2025-02-06 09:48:12,https://www.reddit.com/r/Kenya/comments/1iiyykv/advice_for_every_kenyan_who_works_for_an_ngo_non/,3,4,usaid kenya funding cut
"""USAID was helping pay nurses' salaries.""",I have seen this claim being thrown around casually without any concrete referencing. Is there any official financial audit report breaking down USAID projects and how they used its funds in Kenya? ,Kenya,krisdyabe,2025-02-05 11:32:21,https://www.reddit.com/r/Kenya/comments/1ii7ywd/usaid_was_helping_pay_nurses_salaries/,2,15,usaid kenya funding cut
Trump/ The Republicans are not guessing he is implementing Project 2025,"Project 2025 is a political plan developed by The Heritage Foundation, a conservative think tank in the United States, to prepare for a potential Republican administration in 2025. 

It is essentially a blueprint for how a new conservative president could reshape the U.S. government.  

The plan focuses on four main pillars:  

1. Policy Agenda – It outlines conservative policies for major government agencies, including reducing government regulations, cutting welfare programs, and increasing executive power. 

2. Personnel – It aims to recruit and train conservative individuals to fill key government positions, ensuring the administration aligns with their ideology.  

3. Training Academy – It includes an online education program to train appointees on how to implement conservative governance.  

4. Transition Plans – It provides a detailed strategy to quickly implement these policies as soon as a Republican president takes office.  

For Kenya, Project 2025 might is  relevant in terms of U.S. foreign policy, as it proposes changes to how America engages with international organizations, aid programs, and global trade. 


It is shifting U.S. relations with Africa, affecting trade, aid, and diplomatic strategies.",Kenya,OldManMtu,2025-02-05 08:53:49,https://www.reddit.com/r/Kenya/comments/1ii5ves/trump_the_republicans_are_not_guessing_he_is/,1,5,usaid kenya funding cut
The end of USAID means Kenyan's losing their jobs,"There is probably a whole industry of local Kenyan workers in NGOs and other organizations that were benefiting from US dollars in the form of USAID funding and other organizations. People who were getting Ksh400k salaries and much better than that for doing much less work than their neighbours. Those jobs directly resulted in neighbourhoods like Ruaka, Roysambu, even way up waiyaki way like Muthiga suddenly having such high rents. Its become impossible for normal hustlers to find a decent place to live near Nairobi.

I wonder what happens to these people, can they find a job somewhere else?

Also Trump has not finished, there will be more cuts, more funds and organizations that are shut down. I wonder how much the Kenyan economy was getting out of the inefficiency and extravagance of US spending??",Kenya,muerki,2025-02-05 06:57:44,https://www.reddit.com/r/Kenya/comments/1ii4bja/the_end_of_usaid_means_kenyans_losing_their_jobs/,195,246,usaid kenya funding cut
Inflation rate versus central bank rate..,"I see inflation in Kenya has been sub 3% for a couple of months, why is the CBR not following the same curve closely?

Edit: eyes on CBK https://www.businessdailyafrica.com/bd/economy/eyes-on-cbk-for-benchmark-rate-cut-as-inflation-falls-to-2pc-4910748",Kenya,duke-of-Tabata,2025-01-31 23:33:27,https://www.reddit.com/r/Kenya/comments/1iespif/inflation_rate_versus_central_bank_rate/,1,4,usaid kenya funding cut
How does Trump being the US President affect you as a Kenyan ?,"
So ARVs/TB drugs  aren’t free because the government loves us it’s because they are donations and US is among our major donors so yeah shortages in ARVs will probably happen especially with PEPFAR Funding Halt(  this simply means the orange dude  has ordered an immediate stop to the supply of lifesaving drugs for malaria, HIV, and tuberculosis ) We have other donors BUT them change will definitely be felt . 


You are probably wondering how  tf is that my problem ? The U.S. withdrawal from the WHO may disrupt vaccine distribution efforts in Kenya.So yeah you will probably struggle to get your nephew a basic BCG vaccine in future ?


Hopefully the US will honor their pledges so that we don’t have to struggle but considering how much Trump anatupenda vyenye Ruto anatupenda  mmh i can smell the love mixed with some teargas/abuductions  and deportation just how i like it 💕. 

Also if you know how else we will  be affected please share ? ",Kenya,SeaCattle8658,2025-01-30 23:50:23,https://www.reddit.com/r/Kenya/comments/1ie1b2x/how_does_trump_being_the_us_president_affect_you/,35,71,usaid kenya funding cut
Saw almost an entire department in a hospital eliminated cos luck of funding to WHO/USAID,"Dump's orders taking effect. I am mad at our governments who cant function without aid. I am mad at the likes of my brother who vote simply because of abortion and homo and never think other wise. And after working for an NGO for 6 years, I am starting to wonder what's to come next.",Kenya,Deep_Ground2369,2025-01-26 05:32:16,https://www.reddit.com/r/Kenya/comments/1ia6x01/saw_almost_an_entire_department_in_a_hospital/,48,108,usaid kenya funding cut
"If God is all-powerful, He cannot be all-good. And if He's all-good then He cannot be all-powerful","I heard this quote in 2016's Batman vs Superman. I was about 14 years old, a Christian like my parents. I dismissed it as blasphemous and didn't think about it much after that. But over the years, personal and geopolitical events have pushed me to examine spirituality through theological, logical, and historical lenses. I turn 22 this year and now I’m an atheist. This quote resonates with me in a way I never imagined it could.

**The DRC**

In Goma, a church was bombed less than a week ago. Yet, it barely made a blip in international media. The tragedy was just another drop in the ocean of atrocities. A Congolese national on TikTok shared a video of his team delivering aid when a bomb landed just meters away. You can hear the gunshots in the background as they scrambled for safety. In the same video, a woman and her young child calmly narrate the bombing like it’s just another day. Children are trafficked and enslaved to mine the cobalt and coltan that power our smartphones and electric cars. They die in suffocating pits, crushed under collapsing earth. The ones who survive often endure daily abuse, starvation, and diseases no child should ever face. I could give you the statistics but we have been desensitized so that occurrence was the grunge reality of those on the ground. Ponder on it. Then go amplify [Pappy Orion TikTok's page](https://www.tiktok.com/@pappyorion) as he shares with the world the grim reality of those on the ground.

**Palestine**

The following are videos I've seen with my own eyes: A child sits in the rubble of their destroyed home, shaking uncontrollably, panicking, frantically looking for a place to hide as planes pass overhead. A man holds up a half-mutilated body of a child, missing parts from the torso down and flesh hanging off the place of severance. A father, holding the birth certificates of his newborn twins, weeps uncontrollably. They were killed in an airstrike while he was out running errands. A boy stares into the distance with a blank, emotionless face; his entire family is gone. How do you console a child whose world was obliterated in seconds? How do you justify children dying from heart attacks because they’re so paralyzed with fear? [The story of 5 year old Hind Rajab is just devastating](https://www.reddit.com/r/Kenya/comments/1i9099v/the_story_of_hind_rajab/). But instead of universal outrage, we hear excuses. *""Shouldn’t have started a war you can’t win,""* they say. As if that justifies killing children. As if those children were combatants instead of victims. And to those claiming *""It started on October 7th,""* where were you when children were being humiliated, harassed, and terrorized by idf soldiers years before? This isn’t about land anymore. It’s about the inhumanity of it all. And if your reaction is to pick a side instead of mourning the dead, I don’t know what to tell you.

**Sudan**

The UAE has provided funding, logistics, and military equipment under the guise of securing its economic interests. Reports show that weapons and ammunition have been covertly supplied to the RSF, even as UAE denies involvement. Humanitarian aid shipments have been revealed as covers for arms transfers, and recent investigations by US lawmakers confirmed ongoing support from the UAE despite its official denials. Now over 10.2 million people displaced. More than 750,000 people on the brink of starvation. Entire communities wiped out as the RSF slaughters civilians with impunity, committing acts of genocide that shock even those hardened by years of conflict. Families, already living in desperate conditions, are left with no choice but to flee. Refugee camps swell with starving, sick, and traumatized survivors who may never see justice.

**Unequal Attention**

What breaks me most is how unequal the coverage is. It was easier to find the details of Palestinian atrocities than it was for Sudanese or Congolese ones. And I say this as an African. My own people, my brothers and sisters, are so overlooked that their suffering isn’t even documented properly. The media relegates African atrocities to footnotes, treating them as less significant than others. The world cries for Ukraine or Gaza, and they should, but where are those same voices for Sudan and the DRC? The silence is deafening.

**Theological Reflection**

I’m sick of hearing people try to explain this away. Whether in the DRC, Sudan or Gaza, the suffering is not part of some mysterious, divine plan. If God exists and allows this, He isn’t good. If He wants to stop it but can’t, He isn’t powerful. Claiming He’s all-loving in the face of these horrors is an insult to every victim’s memory. Spare me the debates about free will or 'God works in mysterious ways.' There is no justification for this. No excuse for letting innocent children suffer, for letting entire families and communities be destroyed. If your God loves you, fine. But don’t call Him all-loving, because His actions (and lack thereof) don't reflect that.

**Historical Atrocities in the Name of God**

This isn’t a modern problem. Religion has justified horrors for centuries. The Crusades left rivers of blood in their wake. Colonialism destroyed entire continents. In Africa, missionaries came with Bibles in hand, preaching salvation while stealing land and stripping people of their culture. In the Americas, conquistadors slaughtered Indigenous people in the name of Christ. One Native American chief, before being executed by the Spanish, said, *""I do not want to go to heaven if that’s where the Spanish are.""* Can you blame him? Heaven was a place for the colonizers; a paradise for murderers who brought nothing but death and destruction. If that’s God’s plan, I want no part of it",Kenya,Current-Olive-6530,2025-01-24 18:23:27,https://www.reddit.com/r/Kenya/comments/1i926d9/if_god_is_allpowerful_he_cannot_be_allgood_and_if/,6,11,usaid kenya funding cut
How do I cut off friends?,"Wagwan wadau!

So I just realized that some of my friends are bums like myself! We've know each other for a while now BUT based on what I want for my future I'm starting to see them as deadweight.

All we do is party. I've come to the realization that I'm finding it hard to break old habits partially because of their influence. I feel lost in life and made some new year resolutions to turn my life around. I don't hate them BUT I'm finding it increasingly hard to make the necessary changes to my life when they are around. I just want some time to focus on my future and my self-improvement journey. 

I had recently planned on subscribing to a gym but I'm shocked to find out I just drunk all the funds I was planning on using. Now i'm going back to square one. I don't blame them for this BUT It has become clear that I can't properly manage my finances with them around. I've tried to convince them to start some business ventures or projects but these guys aren't clearly motivated as I am. Sometimes I don't want to tell them of the new opportunities I'm getting simply because I know when they know I'm getting paid, the chances of my keeping this money narrows drastically. Like I said, I'm trying to break old habits i.e smoking, drinking...etc and I just can't see myself doing this with them around. 

How do I cut them off, or at least withdraw from their company, without looking like an asshole or 'mtiaji'. I just want to disappear and take some time off to focus on myself and my goals. I feel like I'm in the same place I was 3 years ago. I'm planning on making 2025 my turning point and that's why I'm here. Life is hard for a man and the last thing I want to to be sitting in a room 10 years from now regretting the bad decisions I made in my youth. ",Kenya,Ngonyoku,2025-01-24 16:05:57,https://www.reddit.com/r/Kenya/comments/1i8yu6d/how_do_i_cut_off_friends/,20,44,usaid kenya funding cut
PayPal Account Suspended,"I’m a security researcher and smart contracts auditor. Recently, I received a substantial bug bounty payout for a critical submission to a Web3 company. Everything seemed fine until this morning when I logged in and found my PayPal account suspended for 180 days. No prior warning, just a vague email citing “unusual activity” and a link to their Resolution Center.

As someone who relies on PayPal for professional transactions, this is a huge issue especially since the funds are tied up for months! I’ve already tried contacting support in the Resolution Center, but I’m worried about the lack of clarity and the long hold period. The standard web support feels like a black hole, and I’m not sure if my case is being prioritized.

Has anyone else in the security research or Web3 space faced PayPal suspensions after receiving large bounties? I’m wondering if the high-value transaction flagged their system, especially since it’s related to crypto/Web3. Any tips on how to explain this to PayPal to get it resolved faster?

Are there best practices for security researchers to prevent this kind of thing? For example, should I notify PayPal in advance about large incoming bounties?

I’m super frustrated, as this is my main account for handling payments, and 180 days is a long time to wait. Any advice, success stories, or specific steps you’ve taken to resolve similar suspensions would be greatly appreciated. 

With thanks!",Kenya,pinoccs,2025-05-21 10:26:20,https://www.reddit.com/r/Kenya/comments/1krufhp/paypal_account_suspended/,15,41,usaid suspended funding
USAID Repercussions + Economy,"My neighbour’s wife was a very big shot in USAID and has now lost her job. Children have been removed from big private school. Husband is a big guy at PWC. Lifestyle changes are occurring rapidly as her income has vanished. Thousands of her USAID coworkers were sent home with no salaries. 

USAID Vendors, contractors, non-profits that received funding from them have all been left in a lurch. Sasa machozi zimeanza. 

Next is empty apartments around “high class” areas.

UN is laying people off left right and center.

Additionally, public assistance programs in the Europe and America are being slashed so remittances by a certain sector are falling.

If you think things are hard, ngojeni mpaka December. A lot of your highlife hotspots are about to close. A lot of these restaurants are about to close. 

Crime shall return so please rudini mashambani mulime.

Avoid Mombasa, Lamu and malls.


",Kenya,uasingishu408,2025-05-14 15:11:02,https://www.reddit.com/r/Kenya/comments/1kmhn87/usaid_repercussions_economy/,13,33,usaid suspended funding
